id,summarization,tokens,topics,description
4839957,,[],[],an android library that allows you to easily create applications with slide in menus you may use it in your android apps provided that you cite this project and include the license in your app thanks
2155793,,[],[],paging indicator widgets compatible with the viewpager from the android support library and actionbarsherlock
9603714,,[],[],package manager for xcode
26363421,,[],"['android', 'android-library', 'android-ui', 'material-design']",android library to observe scroll events on scrollable views
85786010,,[],[],code and data for paper deep photo style transfer https and and arxiv org and abs and  
268027,,[],[],no longer superseded by js cookie
11446311,,[],[],xcode plug in which helps you write documentation comment for both objective c and swift
53991171,,[],"['android', 'bottom-navigation', 'library', 'material-design']",deprecated a custom view component that mimics the new material design bottom navigation pattern
33390523,,[],"['android', 'android-library', 'android-studio', 'android-tools', 'animations', 'apps', 'awesome', 'google-android', 'material-design', 'open-source-project']",some android learning hoping to help you learn android development
12283195,,[],[],ios library for quickly displaying images while scrolling
34676773,,[],[],disque is a distributed message broker
10740728,,[],[],ios  and  style side menu with parallax effect
1676966,,[],[],swipe is the most accurate touch slider
45091124,,[],[],horizon is a open source backend for javascript apps
1706871,,[],[],a jquery plugin for inflating web type
42489883,,[],"['android', 'hotfix']",andfix is a library that offer hot fix for android app
4012085,,[],"['adobe-flash', 'adobe-flex', 'apache-flex', 'clipboard', 'dom', 'flash', 'frontend', 'web', 'zeroclipboard']",the zeroclipboard library provides an easy way to copy text to the clipboard using an invisible adobe flash movie and a javascript interface
14454268,,[],[],a jquery plugin for extracting the dominant color from images and applying the color to their parent
13200787,,[],[],a simple keyframe based animation framework for uikit perfect for scrolling app intros
50301368,,[],[],rabbit tophat see what a program does before deciding whether you really want it to happen no longer maintained
18607529,,[],[],this repo is being deprecated please check out http and and github com and famous and engine
69828680,,[],[],leaked mirai source code for research and ioc development purposes
21490963,,[],[],sample project created to show some of the best android practices to work in the android ui layer the ui layer of this project has been implemented using mvp or mvvm without binding engine to show how this patterns works this project is used during the talk effectiveandroidui
39103837,,[],[],docker implemented in around  lines of bash
14393731,,[],[],a sample android app which showcases advanced usage of dagger among other open source libraries
46527265,,[],"['artificial-intelligence', 'deep-learning', 'ios', 'machine-learning', 'macos', 'ocr']",the swift machine learning library
33581487,,[],"['image', 'lazy', 'load']",a modern lazy loading library for images
20232642,,[],"['animation', 'pop', 'transition-animation']",a collection of animation examples for ios apps
26103342,,[],[],the missing spotlight plugin system
24478678,,[],"['animation', 'dom', 'effects', 'fx', 'transitions']",morph dom elements from one state to another with smooth animations and transitions
18981255,,[],[],sublime like terminal based text editor
7694208,,[],[],deprecated recyclerview made simple
904419,,[],[],a easy to use javascript span injector for radical web typography
58605580,,[],[],boom puts your console on blast when react is making unnecessary updates
10697582,,[],"['jscs', 'unmaintained']",javascript code style checker unmaintained
66682814,,[],[],image super resolution through deep learning
4047080,,[],[],a running jumping swordfighting game i made on the apple ii from  
10575878,,[],[],a web interface for formerly known as dockerui this repo is not maintained
4710876,,[],[],android common include utils and so on
33456123,,[],[],intelligent ios permissions ui and unified api
46531155,,[],[],efficient image captioning code in runs on gpu
2310615,,[],[],a easy to use jquery plugin for fluid width video embeds
2893217,,[],[],a workflow for building backbone applications
40877175,,[],[],google material designandroid     mvp      
40102186,,[],[],android adapter for item
36187165,,[],['palette'],extract prominent colors from an image js port of android s palette
5263633,,[],"['macros', 'parser']",sweeten your javascript
19094829,,[],[],an im app like wechat app has to send location managing local address share a circle of drifting shake a fun and more interesting features
4028308,,[],[],css list scroll effects
7830512,,[],[],xcode plug in that provides autocomplete for imagenamed calls
38284404,,[],[],dexposed enable god mode for single android application
2851354,,[],[],a methodology for documenting css and generating styleguides
10420996,,[],[],the wp rest api has been merged into wordpress core please do not create issues or send pull requests submit support requests to the forums or patches to trac see readme below for links
66913302,,[],"['cli', 'curl', 'http', 'visualization']",curl statistics made simple
47903333,,[],"['angular', 'ngrx', 'redux', 'rxjs']",rxjs powered state management for angular inspired by redux
61687257,,[],[],step by step just use horizontalstepview verticalstepview step indicator flow indicator timeline order process express status
64815511,,[],[],dataset and code for  paper learning a driving simulator
5391743,,[],[],google guice on version   retired
56371551,,[],[],some beautiful android loading can be combined with any view as the loadingview or the progressbar some drawable can customize the loading progress too
3616639,,[],[],kineticjs is an html canvas javascript framework that extends the d context by enabling canvas interactivity for desktop and mobile applications
24162262,,[],[],front end performance heatmap bookmarklet
6859626,,[],"['ios', 'stylesheet', 'stylesheets', 'ui', 'ui-kit']",style ios apps with a similar to css
33951348,,[],[],some basic javascript coding challenges and interview questions
931243,,[],[],produces respawning super cookies in a abusing over a dozen techniques its goal is to identify users after they ve removed standard cookies and other privacy data such as flash cookies lsos html silverlight and others
7293210,,[],[],deprecated a general purpose library for building credit card validating inputs and formatting numbers
20652074,,[],[],android xcl charts is a free charting library for android platform d and d and  and  and  bar chart d and d pie chart  stacked bar chart  area chart  line chart  spline chart  dount chart  rose chart  dial chart  gauge chart  radar chart  funnel chart  circle chart   scatter chart  bubble chart  rangebar chart        
87638072,,[],"['equationgroup', 'exploits', 'hacking', 'nsa', 'shadowbrokers', 'tao']",decrypted content of eqgrp auction file tar xz
5969840,,[],[],classic version of turbolinks now deprecated in favor of turbolinks 
32958241,,[],"['android', 'hacker-news']",hacker news ios and android app made with react native
22652910,,[],[],a complete and versatile web scraper
2346623,,[],['hubot-script'],see https and and github com and github and hubot scripts and issues and  for details optional scripts for opt in via hubot scripts json
20286858,,[],[],android common utils or helper such as etc   k bitmap   shell         base md hex byte number dialog filed class package telephone random
14335772,,[],[],drag and drop library for two resizable and responsive lists
55874746,,[],"['ebook', 'github-books', 'growth', 'idea', 'ideabook', 'phodal']", a growth engineering idea in action
7224705,,[],[],beautiful responsive email templates with code as beautiful as email templates can be
1574656,,[],[],node js auth package more for connect and express apps
42997176,,[],[],explosive dust effect for views
4617120,,[],"['anchors', 'animated', 'animation', 'browser', 'demo', 'flesler', 'jquery', 'links', 'scroll', 'scrollto']",cross browser and highly customizable animated scrolling with jquery
36537989,,[],[],realtime cli for live node apps
8062859,,[],[],working copy of the http and  specification
44620036,,[],"['definition', 'management', 'types', 'typings']",deprecated the typescript definition manager
3077195,,[],[],the quickest way to start and publish your jekyll powered blog  compatible with github pages
220418,,[],[],thinkup gives you insights into your social networking activity on and beyond
40691886,,[],[],hackpad is a web based realtime wiki
13715172,,[],[],a xcode  and plugin that adds more flexible autocompletion rather than just prefix matching
31715632,,[],"['animation', 'carthage', 'cocoapods', 'custom', 'drag', 'ios', 'menu', 'navigator', 'persei', 'uicollectionview', 'uiscrollview', 'uitableview']",animated top menu for uitableview and uicollectionview and uiscrollview written in swift
6257984,,[],[],afinalandroidioc orm  finalactivity ui finalbitmap bitmap oom finaldb androidsqlite finalhttp ajaxhttp 
42849407,,[],[],deprecated  https and and github com and finalteam and rxgalleryfinal
4068818,,[],"['databinding', 'template-engine']",lightweight and powerful data binding
2160835,,[],"['unmaintained', 'unmaintained-dont-use']",take a swig of the best template engine for javascript
38657802,,[],[],a terminal to gif recorder minus the headaches
778981,,[],[],legacy code of vex running on google app engine
40704350,,[],"['vue-cnodejs', 'vue-components', 'vue-router', 'vue2', 'vuejs2', 'webpack']",vue jscnodejs orgwebapp
7119300,,[],"['grid', 'sass', 'stylus']",the most yet grid system available for sass or stylus
12928754,,[],[],ios  and  style blurred view controller that appears on top of your view controller
154789,,[],[],sammy is a tiny javascript framework built on top of it s restful evented javascript
29925100,,[],[],material design style and animations for ionic
21570384,,[],"['angular', 'angular-filters', 'filter', 'ng-pipes']",bunch of useful filters for angularjs with no external dependencies
18727860,,[],[],android library used to create an awesome android ui based on a draggable element similar to the last youtube graphic component
2723064,,[],[],a event driven javascript architecture for developing component based applications
8170346,,[],"['jquery', 'jquery-plugin', 'menu', 'navigation', 'plugin', 'responsive']",sidr is a jquery plugin for creating side menus and the easiest way for doing your menu responsive
68572656,,[],"['parallax', 'transformer', 'transition', 'viewpager']",viewpager with parallax together with vertical sliding or click and activity transition
38846351,,[],[],this is a project designed to help controlling android mediaplayer class it makes it easier to use mediaplayer listview and recyclerview also it tracks the most visible item in scrolling list when new item in the list become the most this library gives an api to track it
1755328,,[],[],an implementation of task and event based asynchronous pattern
3429960,,[],[],javascript library for one directional scrolling with item based navigation support
9873882,,[],[],collaborative editing for vim
22845841,,[],[],persistent two way databinding
5567476,,[],"['angular', 'angularjs', 'cookie', 'localstorage']",an angularjs module that gives you access to the browsers local storage with cookie fallback
15715000,,[],[],yeoman generator for reactjs and webpack
38110583,,[],[],deprecated just a sample of the android percent support lib
45137369,,[],[],a recurrent neural network for generating little stories about images
17107214,,[],"['minimalist', 'progressbar']",very lightweight progress bars no jquery
8239165,,[],[],icon font library for ios currently supports font foundation and ionicons
29536194,,[],"['android', 'android-pathview', 'animation', 'svg']",android view with both path from constructed path or from svg
15703784,,[],"['clang-format', 'plugin', 'xcode', 'xcode-plugin']",xcode plug in to to use clang format from in xcode and consistently format your code with clang
29785166,,[],[],pencil practical comparison of different flux solutions
30810457,,[],[],usbkill is an anti forensic kill switch that waits for a change on your usb ports and then immediately shuts down your computer
54940914,,[],[],open source version of jianliao com
55743562,,[],"['activityrouter', 'router']",router activities and methods with url for android
26663083,,[],[],a charting tool that produces shareable charts from any data file
15680192,,[],[],a surgical debugging tool to uncover the layers under your app
13889021,,[],[],add a progress meter to your loops in a second
1539787,,[],[],play your company s dj
273718,,[],[],html web socket implementation powered by flash
9904556,,[],[],a core audio based streaming audio player for ios and macos
1518559,,[],[],a friendly wrapper for launchctl
53020467,,[],"['animation', 'guidepageview', 'viewpager']",combine viewpager and animations to provide a simple way to create applications guide pages
9954710,,[],[],classical equations and diagrams in machine learning
22777776,,[],[],a general theory of reactivity
21897528,,[],[],selection of projects accompanying the ios day by day blog series
8680846,,[],[],a markdown editor http and and lab lepture com and editor and
10013861,,[],[],easy to use listview with pinned sections for android
1405796,,[],[],a drop in inline browser for your ios app
11390832,,[],"['architecture', 'book', 'c-plus-plus', 'design-patterns', 'game-development', 'markdown', 'optimization']",source repo for the book
21758476,,[],[],easy benchmarking of all publicly accessible implementations of convnets
13838338,,[],[],collection of ios drop in components to visualize progress
86901323,,[],[],configurable animations based on points
27065091,,[],[],javascript library enabling svg icons to morph from one to the other it implements material design s delightful details transitions this project is not maintained anymore
5429498,,[],[],multiple skin admin template
53668878,,[],[],an open source version of a game engine developed by croteam for the classic serious sam games
5219439,,[],[],open  api compatible replacement of uicollectionview for ios  and
12876724,,[],[],format html inputs to match a specified pattern
41328612,,[],"['icmp', 'proxy', 'tunnel']",transparently tunnel your ip traffic through icmp echo and reply packets
481811,,[],[],large scale server deploys using bittorrent and the bittornado library note project no longer maintained
2014561,,[],[],local server for android s hierarchyviewer
3027949,,[],[],the definitive html mobile javascript framework
4864799,,[],[],angularjs webinspector extension for chrome
67722319,,[],"['big-data', 'distributed-computing', 'linear-regression', 'simple', 'tensorflow', 'tensorflow-examples', 'tensorflow-exercises', 'tensorflow-tutorials']",bare bone examples of machine learning in tensorflow
8256156,,[],[],an activity diagram to describe the resolution of http response status given various headers
2629802,,[],[],a framework for developers who want to build and share cross device applications
2238128,,[],[],a minimal amd api implementation for use after optimized builds
28677272,,[],[],example code for my building and deploying microservices with event cqrs and docker presentation
14439422,,[],[],create image differential between two images
61919271,,[],"['ast', 'component-hierarchy', 'developer-tools', 'react', 'redux', 'visualization']",a developer tool to visualize a react application s component hierarchy
15299224,,[],[],spdy for ios and os x
18831424,,[],[],custom transition between viewcontrollers holding tableviews
19267652,,[],[],go style concurrency in c
7209011,,[],[],a tooltip style toolbar jquery plugin
55352449,,[],[],a cool search view animation library
66422965,,[],"['css-framework', 'cssnext', 'design', 'flexbox', 'mobi-css', 'mobile', 'mobile-first', 'postcss']",a mobile first css framework
14614459,,[],[],production quality meteor deployments
31394531,,[],"['babel', 'best-practices', 'isomorphic', 'nodejs', 'react', 'universal', 'webpack', 'wonderful']",create an isomorphic react app in less than  minutes
7491531,,[],[],html inspector is a code quality tool to help you and your team write better markup it s written in javascript and runs in the so testing your html has never been easier
41651407,,[],[],an implementation of the paper a neural algorithm of artistic style
48935181,,[],[],patterns for using flexbox css to build awesome ui components
47060103,,[],"['card', 'slide-card', 'tantan', 'viewdraghelper', 'viewgroup']",enable users to slide card to the left or right smoothly and continuously
45316202,,[],[],ruby idiomatic refactoring and best practices
102494292,,[],"['animation', 'flowlayout', 'ios', 'iphone-x', 'scroll', 'tiles', 'uicollectionview', 'xcode']",vegascroll is a lightweight animation flowlayout for uicollectionview completely written in swift compatible with ios  and xcode 
9214768,,[],[],skull this repository is because it has been split into https and and github com and linuxbrew and brew and https and and github com and linuxbrew and homebrew core
5418669,,[],[],the jquery plugin for big background video and images
31860188,,[],[],wave motion detection using the doppler effect
66072861,,[],"['dagger2', 'greendao', 'mvp', 'news', 'photo-browser', 'retrofit', 'rxjava', 'video-player']",android mvp architecture
16750251,,[],[],a linux system information web dashboard using psutils and flask
26710221,,[],[],over  customizable icons for android including  and google material design  ready made social and more
83137235,,[],"['douban', 'superagent', 'vue-cli', 'vue-demo', 'vue-resoure', 'vue-router', 'vue2', 'vuex', 'webpack2']",awesome douban demo created with vue x and vuex and vue router and superagent
81436215,,[],"['android-application', 'material-design', 'music-player', 'mvp-android', 'retrofit2-rxjava']",a grace material design music player
15263202,,[],[],increase your landing page conversion rates
72081317,,[],"['card', 'cards', 'flow-layout', 'itemtouchhelper', 'layoutmanager', 'swipeable']",some custom layoutmanager such as swipecard flowlayout layoutmanager     
4455122,,[],"['bootstrap', 'metro-ui']",simple and complete web ui framework to create web apps with windows  metro user based on bootstrap 
5284910,,[],[],smart less css mixins library
7268697,,[],"['boilerplate', 'mongodb', 'nodejs']",construction project see aqua and frame
48629072,,[],"['angular2', 'growth', 'growth-hacking', 'ionic', 'ionic2', 'phodal', 'repractise']",v  please update to growth   growth app to help you be awesome developer awesome hacker
15117001,,[],[],validator component for vue js
32148751,,[],"['android', 'animation', 'collection', 'module']",user profile interface animation
3626870,,[],[],no longer maintained develop for  x and dude
4398942,,[],[],asgard is deprecated at netflix we use spinnaker www spinnaker io web interface for application deployments and cloud management in amazon web services aws binary download http and and github com and netflix and asgard and releases
2324107,,[],[],drop in sharing features for all iphone and ipad apps
51025772,,[],[],a simple webpack tutorial
37496940,,[],[],porting uistackview to ios  and
8502433,,[],[],the earliest versions of the very first c compiler known to exist in the wild written by the late legend himself dmr
12434576,,[],[],a powerful little tool for managing css animations
48832504,,[],[], weixin wechat     recyclerview  mvp  wechat weixin 
42249497,,[],"['bayesian-statistics', 'pymc', 'tutorial']",a python tutorial on bayesian modeling techniques pymc
63221595,,[],[],benchmarks for popular cnn models
20146448,,[],[],the basics of a swipeable card interface inspired by tinder
246773,,[],[],a lightweight clientside json document
28197707,,[],"['android-library', 'superslim']",a layout manager for the recyclerview with interchangeable and staggered displays of all with configurable section headers including the sticky variety as specified in the material design docs
4782634,,[],[],compatibility with the functions that ship with php  
55937898,,[],[],download the entire wayback machine archive for a given url
3379489,,[],[],a nodejs library to keep an eye on your memory and discover and isolate leaks
42167511,,[],[],this is a drop down it is more beautiful and powerful than swiperefreshlayout
20968699,,[],[],movie collection and information app for android
60904803,,[],"['mobile-web', 'touch', 'ui-experiment']",a library to create multi device experiments
3044325,,[],[],maple s vim config files
88403801,,[],"['algorithms', 'binary-trees', 'computer-science', 'sort', 'sorting-algorithms']",common and useful algorithms with modern js and beautiful tests
4696667,,[],[],web app for drag drop building bootstrap forms
46862438,,[],[],advanced cpu based password recovery utility
24990127,,[],"['firebase', 'hacker-news', 'react', 'react-app']",react powered hacker news client
39634,,[],[],access core functions on iphone and blackberry using javascript
77010989,,[],[],an imageview can auto scroll with device rotating
7419516,,[],[],the eternal morally vigilant programming language
3765120,,[],"['css-arrow', 'tooltip-arrow']",generate css tooltip arrows
11671333,,[],[],a front end charting application that facilitates easy creation of simple beautiful charts
4415704,,[],[],really simple media queries in sass
4392409,,[],[],console client for evernote
6376011,,[],[],an easily stylable semantic html data grid widget with a javascript api that doesn t suck
23478,,[],[],facebook style tooltips plugin for jquery
1099206,,[],"['html5-canvas', 'image-classification', 'image-processing', 'nudity-detection']",nudity detection with javascript and htmlcanvas
13504233,,[],[],block based animations made comes with easing functions and a caspringanimation replacement
15368044,,[],[],c  is an application to help people develop film at home by providing a series of recipes for photographers to use
451490,,[],[],jquery masked input plugin
25251845,,[],[],ios project bootstrap aimed at high quality coding
41884850,,[],"['android', 'android-development', 'morphing-animations', 'svg-images', 'svg-path', 'vectalign']",tool for create complex morphing animations using vectordrawables allows morphing between any pair of svg images
56657547,,[],[],code for the paper let there be color joint end to end learning of global and local image priors for automatic image colorization with simultaneous classification
52214257,,[],[],a ruby on rails inspired web framework for swift that runs on linux and os x
84085844,,[],"['android', 'blockcanaryex', 'findblock', 'performance', 'performance-monitoring']",make performance bottleneck detection easily when app blocked
10755256,,[],[],a client and server side router designed specifically for meteor
238539,,[],[],wax is now being maintained by alibaba
9908495,,[],[],a showcase collection of various page transition effects using css animations
2361775,,[],[],linear that wrap its content to the next line if there is no space in the current line
31734644,,[],[],a clone of the google now and maps and play persistent search bar
29548071,,[],[],a science fiction desktop running on linux awesome
12180649,,[],[],wypopovercontroller is for the presentation of content in popover on iphone and ipad devices very customizable
4808664,,[],[],bonsaijs is a graphics library and renderer
69570428,,[],[],using fan layout manager you can implement the horizontal the items of which move like fan blades
71976622,,[],"['hack', 'hacking', 'hacks', 'winapi', 'windows', 'windows-api', 'windows-hacks', 'windowsapi']",creative and unusual things that can be done with the windows api
17728623,,[],[],r cnn regions with convolutional neural network features
40329787,,[],"['node', 'package-manager']",package like but faster an alternative package manager for node
17781107,,[],[],a custom element for flexible gif playback
14674225,,[],"['data-viz', 'threejs', 'tron', 'webgl']",web tribute to the tron legacy boardroom scene
20617245,,[],[],an android library and includes kjdatabase kjframeforandroid is designed to wrap complexity of the android native sdk and keep things simple
60341171,,[],[],one custom view for show something just like cards with animations
610547,,[],[],jquery matchers and fixture loader for jasmine framework
10034660,,[],[],thinkandroid  apacheandroid   android android mvc sqlite orm ioc android     android oom     android 
2788082,,[],[],an html and css framework used at sapo for fast and efficient website design and prototyping
9372404,,[],"['countries', 'icons']",a free collection of maps for every country in the available in  sizes or in svg
1840036,,[],[],skynet is a framework for distributed services in go
68827685,,[],"['computer-vision', 'convolutional-neural-networks', 'deep-learning', 'gans', 'interfaces', 'machine-learning']",a simple interface for editing natural photos with generative neural networks
510517,,[],[],jquery plugin reorder and filter items with a nice shuffling animation
456545,,[],[],an apns provider with multi app support
46211416,,[],[],a new kind of terminal
2124683,,[],[],interactive api documentation system
16038543,,[],[],fit things into other things
15470270,,[],[],golang push server cluster
6203428,,[],[],sample apps for node webkit
33357911,,[],[],android boilerplate project using dagger mockito and more
854624,,[],[],no longer maintained a js utility for for parsing urls and extracting information out of them
