id,summarization,tokens,topics,description
33700453,,[],[],easily set mac retina display to higher unsupported resolutions
25102239,,[],"['docker', 'golang', 'management', 'monitor', 'seagull', 'web']",friendly web ui to manage and monitor docker
15236811,,[],[],a library of custom ios view controller animations and interactions
49686795,,[],[],docker to kubernetes in one command
56199482,,[],[],facebook messenger bot  minute tutorial
5679888,,[],[],testing http requests has never been easier nocilla stunning http stubbing for ios and mac os x
10626798,,[],"['android', 'card-scanning', 'credit-card', 'ocr', 'sdk']",card io provides easy credit card scanning in mobile apps
326127,,[],[],the missing ui library for the web
8159609,,[],"['canvas', 'drawing', 'drawingboard', 'paint']",a canvas based drawing app that you can integrate easily on your website
55238527,,[],[],interactive javascript notebooks with clever graphing
58985060,,[],"['android-studio', 'plugin', 'translation']",android studio english to chinese android studio
54070348,,[],[],vgg and vgg on tensorflow
14815748,,[],[],an easier way to handle third party url schemes in ios apps
4657583,,[],[],android imageview widget with zoom and pan capabilities
1931236,,[],[],this plugin is used to fix elements on the page anywhere it still allows the element to continue to move left or right with the horizontal scroll
63730796,,[],[],electron app around pokemongo map
39902722,,[],"['card', 'cascading', 'mansonry', 'minigrid', 'minimal']",minimal kb zero dependency cascading grid layout
7227123,,[],[],simplify your ios and mac analytics
17334244,,[],[],trace objective c method calls by class or instance
468501,,[],[],rails plugin to conveniently handle multiple models in a single form
5744149,,[],[],the essential storekit companion
79366567,,[],[],deep learning with dynamic computation graphs in tensorflow
7377298,,[],[],nsstring and fontawesome
43239563,,[],"['android', 'appbarlayout', 'material-design', 'support-library']",smooth version of google support design appbarlayout
26972032,,[],"['allocations', 'arc', 'backtrace', 'carthage', 'cocoapods', 'heap-snapshot', 'heapinspector', 'instruments', 'ios', 'leaks', 'memory-allocation', 'memory-heap', 'memory-leaks', 'memory-management', 'monitoring', 'performance', 'performance-analysis', 'performance-visualization', 'retain-cycles']",find memory issues leaks in your ios app without instruments
81653189,,[],"['android', 'android-library', 'annotation-processor', 'app-shortcuts']",android library that generates app shortcuts from shortcut annotations
49858180,,[],[],a tcp performance profiling tool
39400754,,[],[],a custom pull to refresh layout which contains a interesting animation
36766479,,[],[],plugin for sketch allowing for css flexbox layouts using stylesheets and prototypes
11827104,,[],[],next generation vim support for atom
17568233,,[],[],variety of angular demos
74047464,,[],"['android-library', 'android-view', 'animation', 'customview', 'dynamic', 'effects', 'ui-components', 'view']",star a cool dynamic view library
50753708,,[],"['sui-mobile', 'vue-resource', 'vue-router', 'vue-sui-demo']",vue  sui mobile demo vue sui vue vue webpack a web app written by vue sui mobile
64744682,,[],"['react', 'react-router', 'redux']",react     react  spa webpack and es and babel and redux and react router an excellent react starter  react starter  vue cli 
1138536,,[],[],a lightweight dependency injection framework for objective c
52667901,,[],[],yet another github client written with react native
71188401,,[],"['gui', 'jq', 'json', 'json-splora']",gui for and manipulating json data
1563595,,[],[],calipso is a simple nodejs content management system based on connect mongoose
130473,,[],[],a simple javascript shopping cart that easily integrates with your current website
7810676,,[],[],a cross browser library for adding ide style behaviors to plain text areas
497608,,[],[],persistence js is an asynchronous javascript database mapper library you can use it in the as well on the server and you can share data models between them
63567028,,[],[], and  and wechat and  and moments and github
16846580,,[],[],authoring tools framework atf is a set of c and net components for making tools on windows atf has been in continuous development in sony computer entertainment s sce worldwide studios central tools group since early  atf has been used by most sce first party studios to make many custom tools such as naughty dog s level editor and shader editor for the last of guerrilla games sequence editor for killzone games including the killzone shadow fall ps launch title an animation blending tool at santa monica a level editor at bend a visual state machine editor for quantic sound editing and many others
22277409,,[],[],swipe between viewcontrollers like in the spotify or twitter app with an interactive segmented control in the navigation bar
33183769,,[],[],a custom zooming transition animation for uiviewcontroller
28574516,,[],[],deprecated reactjs and nodejs express demo tutorial with video universal and isomorphic js shared javascript that runs on both the client server
14474326,,[],[],octopress   jekyll s ferrari
34944760,,[],"['angularjs', 'laravel', 'material']",get started with laravel   and angularjs material
7870903,,[],[],implementing jqueryui drag and drop functionality in angularjs with animation is easier than ever
36710743,,[],[],a mac app to decode and extract images from ios support png and jpg and ipa and assets car files
31919038,,[],[],android shadow layout
16243703,,[],[],a blockchain based dns and http server that fixes https and more
3098140,,[],[],mysql fork maintained and used at twitter
55318630,,[],"['apple', 'apple-documentation', 'playground', 'playgrounds', 'playgrounds-platform', 'swift-language', 'swift-summary', 'xcode']",a summary of apple s swift language written on playgrounds
39222173,,[],"['android', 'android-library', 'animation', 'motion']",a motion driven animation framework for android
29912012,,[],"['android', 'reverse-engineering']",reverse engineering tools for android android 
34301795,,[],"['collection', 'pagecontroller', 'parallax', 'parallax-header', 'tabcontroller', 'tableview']",segment tab controller with parallax header
63655543,,[],"['effect', 'library', 'text']",a tiny javascript library for obfuscating and revealing text in dom elements astonished
26014537,,[],[],tmi too many images discover your image weight on the web
56219025,,[],"['android', 'picker-library', 'timepickerdialog']",an android time picker library
56403768,,[],[],rocket a babel preset and plugins for optimizing react code
24201496,,[],[],a small library for generalized transformation of data inspired by clojure s transducers
1735848,,[],[],easily use backbone js with rails  
1629171,,[],[],a simple javascript framework for creating games and apps
55289739,,[],[],a pull to refresh layout for the recyclerrefreshlayout is based on the swiperefreshlayout support all the highly code etc really a practical refreshlayout
1904718,,[],[],the semantic css grid
80681483,,[],[],a react native app simulating eleme app run ios and android
25570987,,[],[],a secure socket tunnel works on getqujing com
60250640,,[],[],a toolkit help to build android mvvm application
20535693,,[],[],a hacker news reader in swift
5283216,,[],[],find unused and duplicate css
44912039,,[],[],an android mvp architecture diagram framwork
32192427,,[],[],an android password view that looks like the pay password view in wechat app and alipay app
1234795,,[],[],mvc framework built on node js works on server and browser
11756078,,[],[],picast turns your  raspberry pi in to a chromecast like device
41726664,,[],"['fragments', 'slide', 'taobao']",vertical slide to switch to the next fragment looks like vertical viewpager
8494263,,[],[],pull to refresh for the web
12924500,,[],[],taste global original animation
6300427,,[],[],web based pp file sharing built on webrtc data channels api
64168112,,[],[],a reliable tool for performing automated code refactoring
43213660,,[],[],presentation materials from cppcon 
1589604,,[],[],an example application for creating page curl and flip effect on android using opengl es
83523633,,[],"['android-pay', 'android-pay-lib', 'android-pay-library', 'pay-bill']",a pay library for and which support wechat pay and ali pay and developer can easily use wechat pay in two lines of code and developer can easily use ali pay in three lines of code   
41967587,,[],[],deprecated an android library that brings the expandable layout with various animation you can include optional contents and use everywhere
19928024,,[],"['crawler', 'pipeline', 'schedule', 'spider']", golang an awesome go concurrent crawler spider framework the crawler is flexible and modular it can be expanded to an individualized crawler easily or you can use the default crawl components only
17637945,,[],[],a drop in replacement for uisegmentedcontrol for showing to be used typically on a user profile
15907840,,[],"['gif-library', 'gifs', 'jekyll']",joy camera sparkler storage place for all mah gifs
1093060,,[],[],openelec the living room pc for everyone
17704954,,[],['url-router'],yet another url router for ios
25522248,,[],"['chrome-devtools', 'snippets']",chrome devtools code snippets
68417164,,[],"['deep-learning', 'machine-learning', 'tensorflow', 'wavenet']",speedy wavenet generation using dynamic programming zap
6160121,,[],[],the scripted code editor
48028972,,[],"['authentication', 'frontend', 'login-flow', 'react', 'redux']",key a login and register flow built with react redux
24306852,,[],"['cash', 'credit-cards', 'icon-pack', 'icons', 'money', 'payment', 'paymentfont', 'webfont']",a sleek webfont featuring your favourite payment methods
60592831,,[],"['vue-mobile', 'vue-ui', 'weui-vue']",an ui framework build with vue js for mobile webapp
25623543,,[],[],an all in one tool to activate and diagnose macos    continuity on compatible mac configurations
86332745,,[],"['adversarial-nets', 'dcgan', 'gan', 'infogan', 'wasserstein-gan']",resources and implementations of generative adversarial nets infogan
6665626,,[],[],a sublime text plugin for arduino
9603444,,[],[],mobile friendly angularjs carousel
32909821,,[],"['animation', 'support-3d-touch']",sahistorynavigationviewcontroller realizes ios task manager like ui in uinavigationcontoller support d touch
15037688,,[],[],encryptr is a zero knowledge cloud based password manager and e wallet powered by crypton
5906854,,[],[],a delicious way to organize programs
21945852,,[],[],ios and objective c an extremely simple uialertview alternative
13638851,,[],[],a super charged version of myintroductionview for building custom app introductions and tutorials
13963501,,[],[],a quick look plug in for mobileprovision files
3602702,,[],[],a python library for oauth   and  and ofly
67930104,,[],"['android', 'flip-animating', 'opengl-es', 'pageflip', 'pageturnning', 'reading-program']",d style page flip on android
29837537,,[],[],procedural texture generator
26163862,,[],"['cnodejs', 'ionic', 'ionic-framework']",the mobile app of https and and cnodejs org made by ionic  web demo http and and lanceli com and cnodejs ionic
88262950,,[],"['equationgroup', 'nsa', 'shadowbrokers']",decrypted content of odd tar xz swift tar xz gpg and windows tar xz gpg
77157552,,[],[],a photoview to scale image and finish activity photoview
3106812,,[],[],a web interface for managing redis and live monitoring
61652964,,[],[],chrome extension for full text history search
53408768,,[],[],temporal reprojection anti aliasing for unity   and
86488003,,[],"['gui', 'qt5', 'radare2', 'reverse-engineering']",this project has been moved to
75108785,,[],[],the magic of google autocomplete while you re typing anywhere
1174826,,[],[],html content and article extractor in scala open sourced from gravity labs
939653,,[],[],smooth scrolling and smart navigation when user scrolls on one page sites
570427,,[],[],jstorage is a simple key and value database to store data on browser side
72390385,,[],[],a fork of sudo with touch id support
56949117,,[],"['fab', 'floatingactionbutton', 'floatingmenu', 'toolbar', 'transition']",a toolbar that morphs from a floatingactionbutton
99725988,,[],[],analyze the security of any domain by finding all the information possible made in python
1853821,,[],[],an agile project planning tool
65116637,,[],"['nodejs', 'p2p', 'privacy', 'webrtc']",free and reliable audio calls for everyone w and browser pp
3065948,,[],[],cassowary and future ready
22492580,,[],[],blast text apart to make it manipulable
50782407,,[],[],a lightweight string extension for swift
53822374,,[],[],a label view for displaying numbers which can transition or animate using a technique called number tweening or number morphing
34562528,,[],[],pretty material design toasts with feedback animations
4177129,,[],[],a dsl for data manipulation
74459584,,[],[],gank io kotlinandroid kotlin dagger databinding rxjava retrofit okhttp
22106659,,[],[],twitter style splash screen view grows to reveal the initial view behind
71001215,,[],[],an incomprehensible hellscape of spaghetti code
71466273,,[],"['big-data', 'golang', 'map-reduce', 'poseidon', 'search-engine']",a search engine which can hold  trillion lines of log data
62599377,,[],[],big o complexities and poster of common algorithms used in computer science
47877423,,[],[],simple javascript client for graphql
13336304,,[],"['polyfill', 'scrolling', 'sticky']",deprecated a position sticky polyfill that works with filamentgroup and fixed fixed for a safer position fixed fallback
31793490,,[],[],parameterized ergonomic keyboard
29925020,,[],[],an atom package that allows for epic pair programming
10147130,,[],"['antivirus', 'antivirus-evasion', 'veil', 'veil-evasion']",veil evasion is no longer use veil  
63071966,,[],[],a library for using eventbus between useful in the ipc or plugin development
2765504,,[],[],fat free forum software
212873,,[],[],the javascript infovis toolkit provides tools for creating interactive data visualizations for the web
15429152,,[],[],a sample android application that demonstrates how to implement various visual effects
11469930,,[],[],robrowser is a free and open source implementation of the ragnarok online mmorpg for web browsers written from scratch using the latest web standards file
28601395,,[],['xcode-plugin'],control your iphone from inside xcode for end to end testing
77204083,,[],[],a guard to help you check if you make ui changes not in main thread
55865493,,[],"['css-in-js', 'css-modules', 'react', 'webpack']",define react presentational components with css
35588028,,[],[],programmatic view layout for the rest of us
37250561,,[],"['caffe', 'face-recognition']",original caffe version for lightcnn  highly recommend to use pytorch version https and and github com and alfredxiangwu and lightcnn
37366203,,[],"['generator', 'react', 'styleguide']",easily generate a good looking styleguide by adding some documentation to your react project
9428060,,[],[],an html presentation builder written by python
25694560,,[],[],breakout detection via robust e statistics
16753614,,[],[],chat using imessage from your terminal
91197196,,[],[],my first venture into raspberry pi stuff running a custom pure data patch i ve been working on for a couple years on a raspberry pi  this project took a couple months and i m still tweaking stuff here and there but it s pretty much it even survived it s first live show
67779826,,[],"['animation', 'css-animations', 'radio', 'radio-inputs', 'radiobox']",tiny set of pure css animations for your radio inputs https and and kb github io and radiobox css and
69952565,,[],"['diagonalview', 'ui-design']",provide diagonal cut on view with awesome customization diagonalview
4249194,,[],[],angularjs reference architecture
109349536,,[],"['ads', 'fresco', 'imageview', 'recyclerview', 'view', 'zhihu']",an imageview display in looks like window
785576,,[],[],lightweight but rich data grid with resizable columns and a scrolling data to match the plus an ability to connect to an xml and json based data source using ajax to load the content
9544489,,[],[],a responsive multi level menu that shows its submenus in their own allowing for a space saving presentation and usage
22991513,,[],[],deep pink is a chess ai that learns to play chess using deep learning
1231239,,[],[],toxiclibsjs is a library for computational design tasks with javascript this library is a port of http and and toxiclibs org for java and processing
37862060,,[],[],use the full power of react and gsap together
31368225,,[],"['ansible', 'automation', 'best-practises', 'infrastructure']",a project structure that outlines some best practises of how to use ansible
46982447,,[],"['nba', 'nbaplus-server']",a concise app about nba news and event with rxjava and eventbus
23206986,,[],[],execute untrusted code with custom permissions
20692961,,[],[],load json while still loading other scripts
49445266,,[],[],a customizable css only vertical timeline
939532,,[],[],extensible node js library for the amazon web services api
8938941,,[],[],this is what i got when i combined webcam based gesture recognition with hakim el hattab s reveal js
26463140,,[],[],unmaintained like font but for twitter emoji
25414425,,[],[],code repository for the tutorial by kenwheeler build a real time twitter stream with node and react js
69021511,,[],"['editor', 'electron', 'rich-content', 'rich-text-editor', 'themes', 'wysiwyg']",un colored next generation desktop rich content editor that saves documents with themes html markdown compatible for os x linux http and and n github io and uncolored and
38992216,,[],"['apple', 'audio', 'chromecast', 'mac', 'music', 'osx']",cast audio from macos to chromecast
15316534,,[],[],deprecated auth with angularjs
19427138,,[],[],a super simple slideshow plugin for jquery
6146525,,[],[],a demo application for running an oauth server
21393069,,[],"['android', 'camera-api']",simple camera module for android applications
40101642,,[],"['android', 'apk', 'decompile']",apk onekey decompile apk
76743,,[],[],similar to utilizes to provide threaded comments
5308899,,[],[],a simple responsive css grid
12834577,,[],[],c and and package manager
8729689,,[],[],tokumx is a high drop in replacement engine for mongodb and issue tracker https and and tokutek atlassian net and browse and mx and and
39861957,,[],"['database', 'immutablejs', 'react', 'redux', 'storage', 'storage-engine']",persistence layer for redux with flexible backends
58816966,,[],[],kcp server one key install for https and and github com and kcptunsocks and kcptun and tree and router
65111069,,[],"['android', 'drag', 'flow', 'flowlayout']",this is a draggable flow layout lib
22310875,,[],[],a concise mantle like way of working with realm and json
21156155,,[],[],a lightweight module for displaying notifications in your angularjs app
22300494,,[],[],benchmark sinatra like web frameworks
7162561,,[],[],database agnostic orm for go
77472970,,[],[],a collection of react vr a frame experiments
60775510,,[],"['bbs', 'forum', 'hifone', 'laravel']",a open self hosted forum software based on the laravel php framework qq 
10383072,,[],[],a set of simple round icon hover effects with css transitions and animations for your inspiration
43973921,,[],[],powerful auto backdooring utility
5054664,,[],[],filters a list based on a fuzzy string search
1624077,,[],[],librarian a framework for bundlers librarian chef is at https and and github com and applicationsonline and librarian chef
266798,,[],[],the united states code
34237068,,[],[],a flexible tip dialog in android
29284863,,[],[],taoverlay is a minimalistic and simple overlay meant to display useful information to the user
9926585,,[],"['algorithms', 'datastructures']",a library implementing several standard data structures and in javascript its written and tested using node js which is the target platform
141320,,[],[],objective c bindings for yajl yet another json library c library
30827592,,[],[],kotlin bindings for json manipulation via gson
8069402,,[],[],delivery system based on git push and ssh
14835409,,[],"['android', 'android-library', 'async', 'asynchronous', 'cache', 'disklrucache', 'gson', 'reservoir', 'rxjava', 'serialization']",android library to easily serialize and cache your objects to disk using key and value pairs
95568080,,[],[],catgate is a small crawler framework based on chrome extension catgate  
5366221,,[],[],a common solution for cross document communication
12030989,,[],[],a startup template for ruby on rails  applications
21638579,,[],[],wafer is a c language based software platform for scalable server side and networking applications think node js for c programmers
26745537,,[],[],uiscrollview examples for blog post
50607557,,[],[],ecmascript proposal for optional chaining aka existential aka null propagation
54072277,,[],[],simple app that consumes angular material  components
6525865,,[],[],an ios view used for selecting contacts this view is inspired by the contact selection in the ios mail and messages apps
16266277,,[],[],a jquery plugin for preview markdown table of content jquery js toc ztree and online demo site v  
24629188,,[],[],crowbar is brute forcing tool that can be used during penetration tests it is developed to support protocols that are not currently supported by thc hydra and other popular brute forcing tools
18598398,,[],[],a visualization tool for golang project dependency
55598407,,[],"['dagger', 'leancloud', 'material-design', 'mvp-architecture', 'rxjava', 'tinker']",and rxjava and leancloud and  and mvp and tinker
91717932,,[],"['docker', 'docker-container', 'kvm', 'macosx', 'osx', 'osx-kvm', 'osx-virtual-machine']",sxkdvm osx docker kvm and run an osx kvm virtual machine inside a docker container
75848188,,[],"['changing-colorschemes', 'colorscheme', 'terminal-emulators', 'wal']",generate and change colorschemes on the fly use pywal instead
21702863,,[],[],morearty js centralized state management for react in pure javascript
85404210,,[],"['go-tools', 'golang', 'golang-tools', 'gopath', 'gui']",goggles is a cross platform gui for your gopath
86091609,,[],"['docker', 'electron', 'electron-app', 'electron-vue', 'vuejs', 'vuejs2']",electron and vue js for docker
76355803,,[],[],a method to drag the video when playing video
52956753,,[],[],  http and and www ibantang com app  swift xcode   charles
22893799,,[],[],visual studio extension for rust
857400,,[],[],jsdav allows you to easily add webdav support to a nodejs application jsdav is meant to cover the entire and attempts to allow integration using an easy to understand api
1649932,,[],[],modern implementation of the preferences window for os x used in gitbox and mou
17722587,,[],[],user identity management
56555556,,[],"['answer-vector', 'keras-language-modeling', 'language-model']",book some language modeling tools for keras
3554716,,[],[],pill tophat kick ass vim configuration framework
25348,,[],[],mvc components for rails
5039320,,[],[],tomahawk s android music player
97085532,,[],"['arkit', 'augmented-reality', 'carthage', 'charts', 'cocapods', 'graphs', 'ios']",lovely augmented reality charts for ios built with arkit
30622672,,[],[],ditch the rails asset pipeline and roll your own with gulp
99071507,,[],"['color', 'font', 'icon', 'image', 'sakura', 'skin', 'theme']",a lightweight and powerful library for application to switching themes or skins
177620,,[],[],eventmachine proxy dsl for writing high performance transparent and intercepting proxies in ruby
55891154,,[],[],dmplayer is an android music player prototype
22079487,,[],"['boilerplate', 'meteor', 'meteor-apps', 'nodejs', 'react', 'react-router', 'reactjs', 'starter-kit', 'template']",a starting point for meteor apps
39610944,,[],[],changes the windows  login screen background
47682086,,[],"['activations', 'architecture', 'batch-size', 'benchmark', 'caffe', 'caffenet', 'convolutional-networks', 'convolutional-neural-networks', 'dataset', 'imagenet', 'lr-policy', 'relu']",evaluation of the cnn design choices performance on imagenet 
70915986,,[],[],the base code of vue js project
36266374,,[],[],a toolkit for creating plugins for go applications
31872332,,[],[],compiled notes for all  courses in the coursera data science specialization
74115784,,[],"['c-plus-plus', 'compiler', 'constexpr', 'joke']",compile time c compiler implemented as c and and  constant expressions
82258949,,[],"['django', 'django-models', 'django-rest-framework', 'guide', 'guidebook', 'guidelines', 'pip', 'python3', 'python36', 'rest-api', 'restful-api', 'virtualenv']",modern django a guide on how to deploy django based web applications in 
8983878,,[],[],rove is a service that allows you to pregenerate typical vagrant builds
26226014,,[],"['c-plus-plus', 'chromium', 'game', 'ue4', 'unreal-engine']",rich html ui engine for ue
56957347,,[],['wheel'],an android widget for selecting items that rotate on a wheel
20949679,,[],[],tiny swift dsl for autolayout
85486262,,[],"['feature-engineering', 'kaggle', 'quora']",kaggle quora question th and  https and and www kaggle com and c and quora question pairs
20853572,,[],"['concurrency', 'concurrency-gotchas', 'concurrency-issue', 'concurrency-problem', 'concurrent-programming', 'demo', 'multi-threading', 'parallelism', 'showcase', 'thread-safety']",simple show cases of java concurrency seeing is believing
6380965,,[],[],context menu plugin for twitter s bootstrap framework
12802054,,[],[],awesome vim config for everyone
20065203,,[],[],angular provider for preloader animations
55401807,,[],[],project tofino is a browser interaction experiment
