id,summarization,tokens,topics,description
8848607,,[],[],show type signatures when logging blocks
5845542,,[],[],black box tool to bypass ssl verification on even when pinning is used
1567174,,[],[],samples for cloud foundry
13987991,,[],[],the repository for this article http and and tympanus net and codrops and  and  and  and medium style page transition and
3170038,,[],[],a collection of ui elements and widgets coded with and sass
3896955,,[],[],contains scipy and r code providing solutions to exercises in elements of statistical learning tibshirani friedman
4998730,,[],[],a loyal data retriever for your rails development databases
8536928,,[],[],pipeable bash script that prints current time while waiting for an input from stdin
8743309,,[],[],profile ruby code and find out exactly how slow it runs
6211162,,[],[],the information can be shown on a toolbar is more than you can imagine ios toolbar extension library
3954203,,[],[],simply reactive declarative orchestration in haskell using rdp
11993635,,[],[],hacker news mobile app
4823494,,[],[],a cocoa audio player component which displays the waveform of the audio file
10845453,,[],[],quick and easy performance analyzer library for golang
1420617,,[],[],ar augmented reality framework for based on a visual code like artoolkit
12489205,,[],[],convert word to with images and math
7341810,,[],[],detecting ios screenshots ala snapchat and facebook poke
9970810,,[],[],appscroll is a tiny  lines js library that fixes the website dragging issue caused on idevices
8108978,,[],[],an android library to enable swipe to dismiss and undo functionality on listviews
4229981,,[],[],a vagrant base box that closely mirrors the celadon cedar stack on heroku
3267670,,[],[],a micro lisp implementation in  lines of ruby
6403491,,[],[],serve high resolution graphics to high density retina like displays with sass
3672047,,[],[],font sass with assets for rails   and
6847112,,[],[],cksidebarcontroller is a uitabbarcontroller like uiviewcontroller for ipad inspired by twitter for as well as my own work
1781184,,[],[],a simple lua web framework for mongrel
7264187,,[],[],checkedthreads no race condition goes unnoticed simple automatic load valgrind based checking
9235644,,[],[],android a viewpager page indicator that displays the current page number and optionally the page count
6650556,,[],[],ios autolayout backport to ios
4935611,,[],[],a node js powered rapid front end development utility
10019217,,[],[],a jquery plugin that turns a one line div into a sweet color swatch
1136112,,[],[],a collection of useful objective c and ios classes
12339565,,[],[],front end for acko net 
2880591,,[],[],plugins for your mongoose schemas
8323759,,[],[],basic wrapper for seaofclouds and tweet js that incorporates functionality with twitter s v  api
2303340,,[],[],a better asset management package for laravel
7535778,,[],[],circular layout for android
1246024,,[],[],geospatial database for the cloud deprecated
2434586,,[],[],windows gui framework for go
9867430,,[],[],twitter music like pull to refresh controller but a bit more enhanced and flexible
14274941,,[],[],examples of uidynamic behaviour of ios
8827770,,[],[],demo of a custom uicollectionviewflowlayout subclass implementation of a roulette wheel of in the style of the yahoo timetraveler app
3240598,,[],[],rawson js is a camera raw previewer in pure javascript
10978068,,[],[],unofficial mirror of hardware video encoding on iphone rtsp server example
384669,,[],[],utility to assist the ajax loading of html containing script tags that use document write mailing list http and and groups google com and group and writecapturejs users
12287957,,[],[],sae java spring and springmvc and mybatis  http and and aixuexiao sinaapp com
12071584,,[],[],thatcloud is an open source ios application that allows you to and work with all of the content you have online
1710651,,[],[],the flixel power tools are a set of plug ins for flixel   and to assist with your game development
9228265,,[],[],star wars jedi knight jedi academy
11389331,,[],[],waterfall style implementation of uicollectionview layout
7849940,,[],[],caldav synch adapter for android
8251418,,[],[],an easy to use library that lets you implement background updates in your app that run whenever the user enters or exits a specified location
2808275,,[],[],foursquare api v for ios
2127316,,[],[],a javascript vnc client
2422681,,[],[],the kademlia dht in javascript for node js and browsers
7143131,,[],[],a javascript script to create a  color palette based on an image inspired by itunes 
3760843,,[],[],pdf from html generation library for ios
8691504,,[],[],non blocking gevent gunicorn example
14510206,,[],[],the server side javascript for glitch that determined all game behavior
6006459,,[],[],a delightful extension to the delightful afnetworking to provide accelerated and resumable downloads
3151061,,[],[],couchdb compatible mobile database android version
476414,,[],[],a node js module for delivering static files
7437202,,[],[],mega man  password generator
6525647,,[],[],got bored of using other so made my own
8742936,,[],[],just like instant saves  of your time on android s custom adapters
14267587,,[],[],an additive synth for clojure and overtone
2601967,,[],[],looking for maintainer oauth   authorization server as a rack module
1688824,,[],[],lightweight and minimalist orm for java and android works with sqlite mysql not actively maintained
182356,,[],[],a python client for accessing the google analytics api
7386592,,[],[],a php library to use the snapchat api
12129587,,[],[],a driver module to make animate css work with angularjs  
4555319,,[],[],genesis texas hold em game server
4697004,,[],[],example animation for ios that sends one view into the background as another view slides up
9295345,,[],[],drag and drop for angularjs
11424141,,[],[],uiscrollview subclass that reuses its tile views
208859,,[],[],port of redis example twitter app to ruby and sinatra
6696037,,[],[],client side web framework for clojurescript
6016224,,[],[],uitableview subclass that abstracts away the ugliness involved with creating static or modular uitableviews settings and menu pages are a snap to create with damodulartableview
7484767,,[],[],a letter to my in ruby
1219981,,[],[],a javascript library to preload all kinds of be it video or with simple syntax
5597755,,[],[],a nodejs server for sending notifications to osx mountain lion s notification center
15209160,,[],[],promise chains with angularjs q tutorial
4936825,,[],[],automatically generates analog circuits using evolutionary algorithms
3793621,,[],['tornado'],pypress rework by tornado
10292696,,[],[],a module for freestanding rust programs
7502565,,[],[],an example of how to do deep routing in an angularjs application when ngview is not enough
6054962,,[],[],fangle creates interactive pages from plain text
11580738,,[],[],easy regular expression building
8570854,,[],[],one does not simply log a message
12559993,,[],[],nslog replacement for coders
7229343,,[],[],scaffolding for your core data models
11505912,,[],[],an on scroll effect template that animates the sides of sections once they are in the viewport
6382493,,[],[],simple library which enable you to add a drawer slide out navigation to your android application
916970,,[],[],watcher is a daemon that watches specified files and folders for changes and fires commands in response to those changes it is similar to configuration uses a simpler to read yaml file instead of a plain text file it s also written in making it easier to hack
1439382,,[],[],nodejs object relational mapping
9198813,,[],[],demonstrates how to manage two fragments where portrait displays them in a viewpager and landscape displays them side by side
8453404,,[],[],cms developed with laravel  php framework and angularjs
1565025,,[],[],ryan zezeski s working blog
11758219,,[],[],a simple starter kit for constructing twitter bootstrap  and themes
6328341,,[],[],technical interview workshop
1434717,,[],[],mp voice recorder sample for android
3973266,,[],[],the app scrolls is a magical tool to generate new rails apps and modify existing rails applications coming to include your powerful magic
1611009,,[],[],open source web based media streamer and jukebox fork of subsonic supports aac and other streamable audio and video formats runs on gnu and linux and mac using java
15434820,,[],[],search stackoverflow and paste code snippets without leaving sublime text
11451430,,[],[],python code for creating a dataset for a dot density map for every person in the u s color coded by race and ethnicity
642536,,[],[],eeepub is a ruby epub generator
254184,,[],[],zero downtime table migrations in mysql
9276490,,[],[],custom uinavigationcontroller
9805058,,[],[],a way to enable wink to take a photo with google glass
8284020,,[],[],port of libmplame to javascript using emscripten
505633,,[],[],pure javascript epub reader
4744047,,[],[],a go package to observe notable events in a decoupled fashion
3225624,,[],[],blossom is an ios style user interface framework for the web javascript canvas and implicit animation
10026965,,[],[],a talking jarvis program written in python
7717823,,[],[],iiithumbflow is a simple ios view component for presenting images in a vertical flow style
14417601,,[],[],python oauth   client and server library
1515695,,[],"['build-system', 'nodejs', 'unsupported']",the java and coffee script and css and less builder and bundler and packer and minifier and merger and checker
3416668,,[],[],code examples for my java artificial intelligence book
12156440,,[],[],render coretext use gcd
3249576,,[],[],a framework to optmize swc and swf files
4040531,,[],"['capistrano', 'chef-solo']",combines capistrano with chef solo
7434812,,[],[],a list of  javascript refactoring based on the  days of refactoring book by sean chambers and simone with the applied solutions
5650739,,[],[],true bittorrent dht in javascript
2929332,,[],[],deprecated chef fundamentals training materials
2138219,,[],[],symfony  tutorial creating a blogging website http and and tutorial symblog co uk
194810,,[],[],contact and invitation management for the django web framework
8472940,,[],[],teamtoytodo  teamtoy net teamtoypocket gplv  phonegap  phonegap and phonegap phonegap js
2819421,,[],[],deprecated see below gradual typing for clojure
7723108,,[],[],artisan is a simple ios application to search for and display information and related mixes from a particular musical artist
494591,,[],[],ronin is a ruby platform for vulnerability research and exploit development ronin allows for the rapid development and distribution of exploits or via repositories
6475872,,[],[],state machine library for objective c
4961712,,[],[],throttle is a simple node js app that makes it easier to test how a website performs on poor network connections for testing a responsive website on a poor g connection without actually having to have a poor g connection simply connect your mac to share the network connection via run and any connected device will then be throttled to the the network speed you specified throttle was designed to be used in conjunction with a device lab and products like shim or adobe shadow where a shared connection is expected
5107084,,[],[],jmap enhanced edition
7670877,,[],[],simple http client in c
6106867,,[],[],a library for doing stuff to other stuff
3177629,,[],[],mobile first boilerplate focusing on readability
13723768,,[],[],uicollectionviewlayout for displaying cells in groups highlighting one of them
5233277,,[],[],autocomplete redis is a quora like automatic autocompletion based on redis
5552562,,[],[],an implementation of deferred irradiance volumes in webgl
11854629,,[],[],amazon employee access challenge
1938079,,[],[],ios library for connecting photo editing apps
156225,,[],[],nickel extracts and message information from naturally worded text
9860420,,[],[],a tool belt for ios concurrency
7298259,,[],[],simple xcode plugin to visualize view autoresizing if it s set from code
1319436,,[],[],a graphical view into your rails app s performance
10009208,,[],[],whit is an open source sms which allows you to query and several other data apis
6646167,,[],[],sparky js is an idea about client side javascript organization
2717158,,[],[],mou http and and mouapp com and theme for markdown syntax highlighting using ethan schoonover s solarized color scheme
5122525,,[],[],pinch to reveal animation transition built with layer as seen in boeing app for ipad
1502311,,[],[],in use when looking at a javascript this extension will offer to beautify it for you uses http and and jsbeautifier org
3888919,,[],[],a web based d gcode viewer to help understand d printer models
8134470,,[],[],create a cloud syncing mobile app in  minutes
10851746,,[],[],javascript and less and css for creating bootstrap themed trees to display hierarchical data
7795747,,[],[],ios image view with transition between images
10310671,,[],[],basic example of a chrome devtools extension with communication between the inspected page and the panel
6254495,,[],[],arduino library for remote control lelo vibrators
3598059,,[],[],digsby im and email and social networks
7321417,,[],[],visualize your javascript with a cps metacircular interpreter
862610,,[],[],deprecated a tool that rewrites your css adding vendor prefixed versions of css rules
1210329,,[],[],fake touch events in desktop browsers unsupported
882891,,[],[],parse markdown syntax with node js
1159273,,[],[],please submit issues and pull requests to the main repository
12220065,,[],[],demo django app using docker
3826809,,[],[],mmir is an experimental rule engine written in clojure
8231348,,[],[],crowy is a communication dashboard supports multiple group communications incluging twitter with hashtag support facebook profile and page and cybozu live and youroom
5076908,,[],[],an html  gaming environment based on raspberry pi
11854477,,[],[],a simple sample showing the different types of notifications on andoid
3510292,,[],[],keeping the project alive with this clone of mauricemach and coffeekup
6030365,,[],[],sample project to use monigusto with vagrant
2580900,,[],[],calayer style api for building high performance ui graphics in webkit
4484315,,[],[],easy to clean calendar view
7809570,,[],[],hadoop log aggregator and dashboard
8355883,,[],[],example of recording then stitching together multiple video segments taken from the camera of an ios device
12689970,,[],[],compares the prices sell and buy for various altcoins on the exchanges coins btc vircurex and crypto trade it executes the sell and buy trades as arbitrage of given percentage is found
7117937,,[],[],porting panic s itunes album art color algortithm http and and www panic com and blog and  and  and itunes  and colors and to javascript
9912689,,[],[],a javascript tool which was made to monitor performance of has a very useful tool named taskmanager can help developers to manage the js tasks in order to pervent page stuck
3492752,,[],[],versatile pull gesture for ios perfectionists comes with pull to create and pull to refresh
3799851,,[],[],class to make a easily customisable action sheet for ios
5358383,,[],[],a scala web application demonstrating event sourcing best practices
13792983,,[],[],art and source for glitch s customizable avatars
1424730,,[],[],the all new clean and ui callback enabled app formerly known as kepler aka pollen planets
5488015,,[],[],and run scripts for the desktop build of open webos
4608909,,[],[],the simplest section adapter for android
138012,,[],[],if you re using you should use sinatra flash instead
14305536,,[],[],ios  colors and gradients
2728643,,[],[],coffeescript and javascript method combinations for underscore projects
4316389,,[],[],a lisp system for the browser
10166640,,[],[],inspired by mailboxapp http and and mailboxapp com a uitableviewcell subclass that makes it easy to add left and right swiping of content in your table views features  swipe zones with customizable colors and sizes
5413380,,[],[],a distributed load test framework using amazon ec instances
2431023,,[],[],ruby and rails centric vimfiles with support for rvm and more
8435786,,[],[],a simple and fast weibo
11284642,,[],[],color picker for android
14835020,,[],[],python orm and odm for the sleepy
1087628,,[],[],diy font face web service
1569925,,[],[],spine demo contact manager
5374173,,[],[],first class postgres feature support for the django orm
8640200,,[],[],a quick custom android dialog project
8232533,,[],[],a library for simulating parallel in clojure
4368432,,[],[],functions for transforming postgresql and pl and v into a totally awesome json document store
1957343,,[],[],a pure js and html markdown editor with live preview and syntax highlighting
11990080,,[],[],perl for ios and os x
10582476,,[],[],give the nsa free backdoor access to your flask app
1646242,,[],[],android location service cache dumper
12389834,,[],[],jquery fullscreen editor
7865360,,[],[],intel s software occlusion culling demo with my modifications
1470507,,[],[],a flask skeleton for google app using html boilerplate templating
11460912,,[],[],this is a text steganography application optimized for use on written in clojure
988678,,[],[],input type range polyfill for firefox
3119164,,[],[],software transactional memory implementation for the jvm
518809,,[],[],lua bindings for qt by mauro iazzi
5405760,,[],[],some dtrace tools written for the smartos and smartdatacenter cloud illumos based
2828482,,[],[],don t allow elements to scroll out of view by having them stick to the top or bottom of a window
1234730,,[],[],key shortcuts made simple
6347457,,[],[],deprecated please use the vitamiobundle and sample
5672117,,[],[],sidebar with folding effect for ios
11348463,,[],[],a replacement for  button uialertview that uses blurring and uikit dynamics on ios 
6941372,,[],[],amazon s multipart file upload for made simple
14497781,,[],[],library for streaming audio over nsstream
13275394,,[],[],simple android view to display list of colorful tags efficiently
7801845,,[],[],von is an opinionated redis stats tracker
4146761,,[],[],a node js cms written in with a user friendly backend
2941226,,[],[],modular restricted boltzmann machine rbm implementation using theano
13168669,,[],[],a library to add peeling to the center of your content
12704847,,[],[],uml files to reverse android frameworks
4697436,,[],[],custom uitableviewcell for ios that supports multiple row selection
1703377,,[],[],a plugin that integrates jshint with vim
10444483,,[],[],bootstrapping an blog using rails and angularjs
13853378,,[],[],an objective c implementation of vector based original implementation by hannu kankaanp http and and www niksula hut fi and hkankaan and homepages and index html
3373795,,[],[],dareloadactivity is a uibutton subclass with a refresh arrow by default with uiactivityindicatorview properties
7399420,,[],[],offheap java pojos with guaranteed memory alignment
6894693,,[],[],ruby binlog based mysql replication listener
9835285,,[],[],for uiview separation with animation
2432283,,[],[],a build server in the cloud
6737170,,[],[],all your lib are belong to us
3474961,,[],[],js based finite state machine for backbone js
13875287,,[],[],a demo of the private blur apis in ios 
14089607,,[],[],a verlet based physics library for svg files written in coffeescript
7227839,,[],[],clockface timepicker for twitter bootstrap
10619731,,[],[],save time add the latest version of gems to your gemfile from the command line
867467,,[],[],a jquery ui theme that uses absolute css power
9931090,,[],[],socket io mongodb demo
6193567,,[],[],experimental sdl based terminal with gnu unifont font rendering using libvterm
8534532,,[],[],configure servers in a snap with these concise ansible playbooks
1309789,,[],[],a jquery plugin to enable the scoped attribute on style blocks
6737965,,[],[],custom emoji formatters for rspec
5087313,,[],[],javascript terminal for firefox
4448890,,[],[],uiimage category which have vimage wrapper functions and the demo project
3697283,,[],[],implementation of google s fastbutton javascript and jquery and xui js integration
6018772,,[],[],archive current work happening at https and and github com and the grid and the graph
8422648,,[],[],ffmpeg  openal openglquartzcore  ffplayios  ffplaysdlopengl es    
7772213,,[],[],a gem for building mobile optimized rails applications using media query based device detection and server side component optimization
1863833,,[],[],create tabbarcontroller with more customization than uitabbarcontroller
10801226,,[],[],integration test between nodejs and php
6414509,,[],[],hungry hero is an open source flash game built on starling framework
1884096,,[],[],first alpha and initial concept of phpspec moved to phpspec and phpspec repo
4788242,,[],[],a lightweight opengl es   framework for ios
246825,,[],[],a c wrapper for the ghostscript library  
10476219,,[],[],a tool to display gesture hints to your users
3930334,,[],[],single page application rocketship
8734563,,[],[],a sublime text plugin which allows using laravel  generators by jeffrey way via the command palette
9795443,,[],[],seahorse is a way to describe your api
8777656,,[],[],a bookmarklet for prettifying your css
14458190,,[],[],web app for interviewing technical candidates in the browser
9634381,,[],[],web api authentication with ssh public keys
2697304,,[],[],simple visualisations of backbone collections via d visualisation library
5557913,,[],[],css kaleidoscope effect
1550805,,[],[],jquery plugin for google maps v api
9423536,,[],[],an android application that rounds the corners of the screen
14433799,,[],[],and other assorted things from www glitchthegame com
9498659,,[],[],use an expanded notification as a makeshift android log output console
6056276,,[],[],java port of arc s readability js parses html as input and returns easy to read text
1493284,,[],[],the junkyard jumbotron is a web tool that makes it really easy to combine a bunch of random displays into a large virtual display it works with smartphones anything that can run a web browser and the magic is that all you need to do to configure one is take a photograph of all the screens
123650,,[],[],make your elements glow ooooh
4655214,,[],[],a cli tool for managing your dotfiles
4154068,,[],[],expanding support for constant space tail calls in the clojure language
7329949,,[],[],browser details is a rack middleware that logs information about the browser used to make a request
7714057,,[],[],aaron swartz s blog posts in and mobi
8280896,,[],[],meteor js smartpackage to publish associated collections at once
2098535,,[],[],an open source payment processing library for codeigniter
9126257,,[],[],this project is meant for people who want to display a calendar view and show that there are events on certain days
4026081,,[],[],rails one click installer for mac os x
2565808,,[],[],a javascript library for building out the logic and ui for business rules
1620849,,[],[],glassy ios buttons with only one color to set
14077067,,[],[],crawling japanese laws
10314195,,[],[],facebook like uinavigationcontroller to slide back to previous view controller
2740353,,[],[],parallax scrolling library javascript
2114475,,[],[],not maintained improve your navigation experience this jquery lib improves a webpage navigation and helps to visualize different sections of a an any web page
6805464,,[],[],master your scroll events
1538255,,[],[],datastax brisk distribution
13306196,,[],[],sample project showing a common architecture i use when creating ios projects
14989296,,[],[],simple scripts to setup a fresh data science box using an ubuntu   lts  bit server running on an ec
530281,,[],[],archived new test framework for clojure
7007153,,[],[],a virtual d universe in your web browser
9501059,,[],[],show view hierarchy in d
7538981,,[],[],measure a function s runtime without adding a single line of code to the original function nothing more
8293120,,[],[],moost last fm s collection of c and and utility libraries
11454201,,[],[],q js has a lot of helpful javascript and works well with other libraries such as jquery
14161710,,[],[],iphone is the new idevice in town yet no longer maintained
3213781,,[],[],ios ui control displaying a set of thumbnails resembling ipad s photos app toolbar thumbnails view
14878542,,[],[],source code for the actionscript virtual machine
6141965,,[],"['cloud', 'iaas', 'openstack-folsom']",a full installation guide for openstack folsom with quantum
5386286,,[],[],a pure css responsive navigation menu
1505103,,[],[],graphite dashboard system
2975780,,[],[],see what your jquery code does inside like a boss
8027643,,[],[],micro responsive that works in every browser
5303571,,[],[],a simple theme for a knowledge base based on kirby
6292589,,[],[],building static empires with node js
1680851,,[],[],jquery slideshow and carousel plugin
12719648,,[],[],advanced jquery boilerplate
9994058,,[],[],a simple example of how to do optical character recognition ocr on ios
2821925,,[],[],these are the supporting materials for my popular series of tutorials on the arduino microcontroller platform
14743998,,[],[],v javascript engine binding for golang
9622149,,[],[],enhanced router is an extension to the laravel  router and provides some enhanced functionality
1672343,,[],[],http interface to libspotify
9374613,,[],[],sublimetext plugin for scope context coloring st and st
12215470,,[],[],data href put an href on it
3833357,,[],[],pitch detection in javascript
5241965,,[],[],an example rails application that uses the jquery fileupload rails and paperclip gems to upload files
