id,summarization,tokens,topics,description
425,,[],[],facebook style built in jquery
291056,,[],[],this is the legacy version of teambox the award winning collaboration inspired by yammer and twitter
2557230,,[],[],unmaintained small components for building manipulating and automating a distributed infrastructure
1714530,,[],[],a horizontal view scroller library for android
761438,,[],[],the html ebook framework to publish interactive books magazines on ipad iphone using simply open web standards
6270574,,[],[],css d dropdown concept
5153205,,[],[],an abstraction layer for webrtc aim is to simplify the html web standard webrtc in a similar manner to socket io w and websockets highly experimental technology
3806475,,[],[],deprecated see natew and obtvse
1802145,,[],[],a uiswitch like segmented control for your ios app
1602291,,[],[],cloud foundry the open platform as a service project
10632915,,[],[],a grid menu with elastic depth of and realistic animation
6778210,,[],[],adds support for background size cover and contain to ie
6422710,,[],[],a simple python tool to pinpoint the ip addresses of machines working for the great firewall of china
1040700,,[],[],the official online compendium for mining the social web o 
14817503,,[],[],fossasia  drupal site
14813775,,[],[],fossasia  drupal site
3349413,,[],[],a simple light weight javascript library for dealing with touch events
9473425,,[],[],super minimal selector and event library
5089138,,[],[],bootstrap toggle buttons has moved to https and and github com and nostalgiaz and bootstrap switch
3639793,,[],[],a cloudfuji chat application
4184416,,[],[],a css and js bootstrap to style and manipulate data tables
470946,,[],[],etherpad open source repository
1096127,,[],[],depthjs allows any web page to interact with the microsoft kinect using javascript
191714,,[],[],less ruby now at http and and github com and cowboyd and less rb
11119992,,[],[],a set of experimental modal window appearance effects with css transitions and animations
2674127,,[],[],a node js based data retrieval and aggregation gateway for quickly consuming http apis
10178606,,[],[],clank open source prototyping framework for mobile apps
1774473,,[],[],a completely open source implementation of a bitcoin miner for altera and xilinx fpgas this project hopes to promote the free and open development of fpga based mining solutions and secure the future of the bitcoin project as a whole a binary release is currently available for the terasic de  development and there are compile able projects for numerous boards
11126140,,[],[],the chrome web lab for hackers and everyone
9792504,,[],[],this is a new navigation controller inspired by flipboard
4467848,,[],[],a new kind of headless webkit integration for nodejs a great alternative to phantomjs
3317938,,[],[],ios view library for displaying stylish errors
10703295,,[],[],easy to use user interface elements which are really similar to design in ios 
1306177,,[],[],instagram like image filters in pure javascript
5371382,,[],"['ios', 'patch', 'wax']",dynamically load a lua script to change the behavior of your ios application
10571816,,[],[],easily add an nsa backdoor into your rails app
8643683,,[],[],a drop in solution for building stylish app introductions and tutorials
10108151,,[],[],just a simply easy way to label each element you want
5691343,,[],[],powerful pattern matching for javascript
1813466,,[],[],saxophone javascript mpeg  audio layer iii mp and idv decoder
8473804,,[],[],a minimal status bar for ios
2629675,,[],[],foundation for a responsive starter theme
9913540,,[],[],make a pattern library using atomic design
457353,,[],[],old v please see http and and github org and telehash now
391267,,[],[],a modular async web framework for node js
9624289,,[],[],this responsive layout is based on an initial grid of four boxes once a box is it gets resized to fullscreen and the other boxes scale down and fade out in the work section we experiment with another transition which is to show a panel by making it appear from the bottom while scaling the current one down to see it in open the work section and click on one of the portfolio items and navigate through them
1661426,,[],[],deprecated a node js application server spawn your own node js on your own hardware
6299699,,[],[],a implementation of roman nurik s and nick butcher s quick return ui patern for a listview
3503557,,[],[],deprecated a replica of the clear iphone app in html
11833467,,[],[],the backend agnostic administration framework
7092862,,[],[],bootstrap ie compatible library
2726128,,[],[],a silly effective md cracker in ruby
3230366,,[],[],command conquer in html and javascript
2450957,,[],[],guide for writing c and and node js extensions
4255862,,[],[],initial directory style guide and pattern primer intended as a starting point for my own available for others to clone and adapt for theirs
10543437,,[],[],a new d effect viewcontroller transition inspired by natgeo city guides by national geographic
12322554,,[],[],the standard ios  colors as a handy category on uicolor
5559313,,[],[],javascript fulltext search engine library
3216266,,[],[],a set of ui elements styled using the boostrap toolkit to use with ember js
1822027,,[],[],rd party extensions for cocosd iphone
9470043,,[],[],a snake ai written in python
5306428,,[],[],a node js http server in your browser
8756877,,[],[],a native particle systems effect view for ios and osx powered by quartzcore
11741832,,[],[],a reproduction of the ios  mail app s swipe to reveal options
12072214,,[],[],thatphoto is an app that lets you view and edit your photos
5941021,,[],[],androidkickstartr helps you to quickly create a well configured android application using the most popular libraries it creates and configures your project for you just focus on code
11622326,,[],[],container orchestration for docker environments
15139581,,[],[],a set of flat and d progress button styles where the button itself serves as a progress indicator d styles are used for showing the progress indication on one side of the button while rotating the button in perspective
5396462,,[],[],sina weibo android sdk
3921398,,[],[],webputty is a simple css editing and hosting service that you can run on google app engine
2142550,,[],[],meta viewport done right
3783995,,[],[],visual tool to create impress js presentations
5283221,,[],[],building ffmpeg for android vfp and used in vplayer for android
10862193,,[],[],hacker news client for ipad and iphone deprecated
3197627,,[],[],the project aims at being a modular backbone environment with as little authority on development as possible such that developers can innovate and contribute in an attempt to mimic the success of backbone js ambiguous nature
12541985,,[],[],a spring like collection view layout the same effect like ios s message app
3606843,,[],[],redis like wrapper for javascript storage
53611,,[],[],textmate bundle for jquery
5056199,,[],[],this plugin no longer supported please use x editable instead
2853502,,[],[],a generic static site generator built using and marked
476166,,[],[],jquery lint is a simple script you can download and use with jquery it works over the top of jquery and diligently reports errors and any incorrect usage of jquery
8993254,,[],[],an android toast similar to the one seen in the gmail app
4382236,,[],[],a personal paas for mac and linux
763605,,[],[],an objective c wrapper around core text for creating multi column text and loading custom fonts
3279226,,[],[],zero downtime reloads and requests load balancer based on distribute
1275916,,[],[],the open source game engine for ios
4165901,,[],[],objc runtime additions
2506397,,[],[],a out of order and real time typeahead search library
1676524,,[],[],jquery mobile angular adapter
1882992,,[],[],css d animation library
1074826,,[],[],legacy openframeworks wrapper for the xbox kinect of pre    and only ofxkinect is now included and is being maintained in of releases
7348960,,[],[],ibooks style d flip transition animation rendered in opengl es   and wrapped in a uistoryboardsegue subclass
12072572,,[],[],thatpdf is an open source application for reading and annotating pdfs
13510786,,[],[],problem you need to store a large amount of key value based data in and firefox
16979,,[],[],rr double ruby is a test double framework that features a rich selection of double techniques and a terse syntax
1473004,,[],[],bob mccune s collection of core animation demos
14143900,,[],[],using svgs on websites is becoming more and more easy with great libraries like snap svg today we want to explore what we can do with it and animate some svg icons as a practical example
9971880,,[],[],a small js library that makes it possible to trace function calls
12364261,,[],[],a embeddable web server for objective c
1032993,,[],[],collection of csshooks that work with jquery    and
3046519,,[],[],backbone js stack boilerplates demonstrating integration with grails and more
6633388,,[],[],write and read markdown in real time with anyone you want
1175501,,[],[],a family of libraries and daemons for building scalable web infrastructure
294069,,[],[],hpricot has ended please consider an alternative like nokogiri
857598,,[],[],an extremely hackable full realtime twitter client
2773714,,[],[],please use koreader instead a pdf plus html viewer made for e ink framebuffer using crengine
10227416,,[],[],layersprites is a library designed to simplify the use of sprite sheets image maps containing multiple sub images in uikit applications without using opengl or rd party game libraries can load sprite sheets in the cocod format
8383053,,[],[],one rest api client for all
1194413,,[],[],a base for longform tablet typography in html
7427888,,[],[],a library to work with css keyframe animations from javascript
3204070,,[],[],modular http server framework for go
1501267,,[],[],lightweight mapreduce in python
335762,,[],[],a webkit based mac os x screensaver use any webpage or javascript program as a screensaver
9212046,,[],[],this is a historical repository of satoshi nakamoto s original bitcoin sourcecode
3924478,,[],[],deprecated pointer js consolidates pointer like input models across browsers and devices
8414241,,[],[],a set of angularjs directives that provide common d visualizations for elasticsearch
745626,,[],[],the objective c http library that apple should have seriously
3923123,,[],[],dsl to document and test web services
9464744,,[],[],drag to go back interaction implementaion
662194,,[],[],jquery d transformation plugin
6187890,,[],[],a library greatly enhancing the features of the google maps external library effortless map gesture map callout built in user tracking etc
7165429,,[],[],generic interactive d transformation tweaking tool for ios development
179087,,[],[],vim plugin for debugging ruby applications using ruby debug ide gem
2097345,,[],[],a lightweight d particle engine in compatible with three js and tween js
3378706,,[],[],a simple focussing on using html notification support in chrome and safari works with mountain lion s notification center
12644632,,[],[],circular progress view button inspired by ffcircularprogressview
6033194,,[],[],a http proxy that lets you map subdomains to git branches for site testing
2262034,,[],[],alicejs a lightweight independent css engine is a micro javascript library for a click the link below
7099873,,[],[],sequencer is an ios library for asynchronous flow control
7847738,,[],[],css spinner for modern built with sass
1880002,,[],[],a fast peg parser written in javascript with first class errors
591795,,[],[],android plugin for the gradle build system
5760207,,[],[],delta jquery ui theme
4445125,,[],[],a cowboy websocket demo
10761652,,[],[],a tutorial on how to create some subtle and modern caption hover effects
11714507,,[],[],highly customizable calendar component for ios apps
13304991,,[],[],historically first actually   release of linux kernel made by linus torvalds
2925873,,[],[],advanced analytics engine for nosql data
787835,,[],[],open transactions democratizes financial and monetary actions you can use it for issuing currencies and paying creating asset sending and receiving digital writing and depositing cashier s creating basket trading on scripting custom recurring etc open transactions uses strong crypto the balances are unchangeable even by a malicious server the receipt history is destructible the transactions are unforgeable the cash is unlinkable the cheques are non repudiable etc
3570375,,[],"['album', 'document', 'gallery', 'image', 'ios', 'library', 'pdf', 'photo', 'showcase', 'video']",an initial implementation of a showcase view controller for ios apps visualizes videos and pdf files beautifully by pittleorg meta viewer
11559584,,[],[],high performance opengl fluid solver in c and and
4868926,,[],[],drop in ios component to easily import photos from and more
11116298,,[],[],automatic squash and stretch animated subclasses of uiview and calayer
10256757,,[],[],a custom table view with highly detailed ripple animations
7550537,,[],[],instrumentation for objective c for debugging and profiling
8836945,,[],[],yet another write optimized storage using buffered b tree algorithm inspired by tokudb
1602284,,[],[],the command line client for cloud foundry the open platform as a service project
6021895,,[],[],a cli share link generator
11295981,,[],[],super simple countdowns
3247154,,[],[],a lightweight query api for backbone collections
3027172,,[],[],the and nebulizer for indextank
10436592,,[],[],a listview and scrollview header that hides when scrolling down and reappears immediately when scrolling regardless of how far down the list we ve gone like the one from the google keep app
6538491,,[],[],demonstration of using corebluetooth on mac and ios
7087398,,[],[], swf   office and pdf and txt and html 
12395584,,[],[],an all in one jquery plugin that let you change your browser s title and more to reflect new notifications
3722494,,[],[],xdebug interface for sublime text 
189325,,[],[],a non instrusive gem which helps you search and manage your data using browser
1290426,,[],[],adaptations and extensions of twitter related examples from mining the social web
13417449,,[],[],this subclass of nsview can be used to get an ios  like blurred background to mimic a frosted glass effect
8004779,,[],[],paperfoldgallery for ios
14851192,,[],[],clapper source code of imax im
181346,,[],[],don t delete your move them to a different table
8296812,,[],[],chrome developer tools extension for debugging backbone based apps
2413268,,[],[],an experimental web framework
4416752,,[],[],unofficial whatsapp client for meego and harmattan
7281004,,[],[],get the size of the css viewport using javascript
11097354,,[],[],dhtcrawler is a dht crawler written in erlang it can join a dht network and crawl many pp torrents the program save all torrent info into database and provide an http interface to search a torrent by a keyword
14905791,,[],[],an example of a gridview with various column span items and drag and drop support like google keep has
13517563,,[],[],ibeacons and corebluetooth
5697382,,[],[],an experiment to control a photo carousel using getusermedia to watch for swipes left and right with a hand
11842466,,[],[],transition from uitableviewcell to detail controller with animation on enter and exit this can be seen in multiple apps right it is totally customizable there are  sections for these animations  initially set frames for all ui elements  now the animation on enter is completed and you have to set the frames according to the detail ui you need  this is the section where exit animation will apply these frames will be equal to the frames which were initially set all these sections are totally customizable and user can set it according to their own needs
7353700,,[],[],jbcroppableview is a subclass of uiview built with uikit and coregraphics that adds n points on an uiimageview allowing to modify them by drag drop to trim the extra space of an image
11923310,,[],[],fling media to a chromecast device
10086817,,[],[],the example source code for the book functional javascript by michael published by o reilly
8069971,,[],[],a language that compiles to css
6459782,,[],[],execute javascript in slow motion
14432340,,[],[],tool to visualize your git in a pretty graph
8063466,,[],[],a test app to visualize view transformation when value in catransformd matrices change
5464728,,[],[],a slide out navigation a k a drawer implementation for android applications
5484271,,[],[],introduction to python and django
9452875,,[],[],google mirror api s quickstart for python
13041437,,[],[],tiny shell is an open source unix backdoor
13464748,,[],[],chrome very easy to use cookies from javascript document cookie and wireshark cookies etc
3537449,,[],[],a simple utility for profile allocation and garbage collection activity in the jvm
3873324,,[],[],chef cookbook for libqt
4437769,,[],[],a prototype trying to create a simple videoediting tool in the browser using javascript
5614225,,[],[],domvas implements the missing piece that connects the dom and canvas
12657746,,[],[],a more sophisticated bitcoin powered crowdfunder
10405378,,[],[],an inline repl for ruby more in sublime text  and 
422331,,[],[],sometimes you need a repl sorry
12948993,,[],[],dagger and otto and retrofit and robolectric and picasso and okhttp
1258829,,[],[],lightweight node and service registry inspired by apache zookeeper
5306424,,[],[],browserver proxy for node js
6049521,,[],"['moderation', 'neural-network', 'nlp', 'sentiment', 'sentiment-analysis']",language sentiment analysis and neural networks for trolls
12917308,,[],[],go on an educational web security adventure
12308823,,[],[],tstableview is ui component for displaying multi columns tabular data
1575328,,[],[],spdy is a protocol designed to reduce latency of web pages
4716147,,[],[],implementation of side navigation or fly in app menu pattern for android based on google and app
9925668,,[],[],a visualization of github users throughout the globe
9154170,,[],[],a hackday project run the speak into your microphone and hear the response from your speakers
392264,,[],[],unmaintained recompiling nes roms into native executables
9092063,,[],[],android plugin framework
6196097,,[],[],a rails plugin for scaffolding views using angular twitter bootstrap and font awesome
8978221,,[],[],detect if the chrome inspector is open or closed
1155062,,[],[],add touch support to your browser with thumbs js a and syntax less library
949339,,[],[],swank and nrepl servers for clojure providing jpda based debuggers
13551739,,[],[],qqrobotc and and   qt qt c and and linux mac oswindows  http and and qt project org and  qqrobotwebqq qq  qqrobot qqwebqq qq  robot  qq    qq  qq robot qtplugin  plugins qq robotrobotinterfacenamelistenandsayok namerobot listenandsay robot
1371723,,[],[],socket io server for erlang
1228777,,[],[],the px css fluid to mobile
5619324,,[],[],the open source teaching materials site for git and github technologies
6552314,,[],[],an alternative to that doesn t tightly couple your view to your model
3727301,,[],[],the sample application to accompany my conference talk enter the matrix on matrix transformations abstract matrix transformations can make your user interfaces come to life and rotate each on its own is relatively simple and straightforward yet many developers are daunted when  or more operations need to be combined what if you need to rotate or zoom about an off center or even off screen point how do you combine multiple transformations into a single animation learn everything you need to know to get started with complex matrix transformations in coregraphics and coreanimation
2577004,,[],[],html audio benchmarks
538835,,[],[],simple ruby authorization system
7411723,,[],[],clean jquery mobile theme pack and theme generator
4803506,,[],[],daanisotropicimage is an anisotropic uiimage generator for a metallic slider knob
8957326,,[],[],utility to connect to open wifi and click through captive portal type agreements
3115793,,[],[],normalized address bar hiding for ios android
550530,,[],[],javascript library for multi step asynchronous logic
4269842,,[],[],a scrolling view of a number of columns containing multiple cells with variable different heights for inspired by pinterest
3647321,,[],[],pull to refresh controller
5247794,,[],[],webrtc io multi user chat demo highly experimental technology
6509937,,[],[],swipe in view controllers from off screen similar to check the weather
1580296,,[],[],the instagram node lib is a helper library for node that makes communicating with the instagram api easy
3079723,,[],[],gae and backbone and require js todo web app example
2607283,,[],[],plugin for cakephp to use from twitter css js framework
7855032,,[],[],ios markdown notebook
5783199,,[],[],golanger web framework is a lightweight framework for writing web applications in go
8582798,,[],[],a horizontal gradient which adjusts its appearance based on the positional attitude of an ios device
12334751,,[],[],flipping elements and show a loading indicator easily
2014445,,[],[],a fast json parser for ios and macos
5594091,,[],[],a browser extension that finds all the fonts on a page
6343553,,[],[],a pull to refresh view for ios  api compatible with uirefreshcontrol in ios 
10766031,,[],[],implementation of the new ios style masking transparency using stackblur
14291024,,[],[],team buffalox predicts directional movement of stock prices
12944981,,[],[],jos mit   operating system engineering
7895284,,[],[],an application that shows a wall of popular or vines from a specified tag
7681910,,[],[],ios audio trim similar to the one seen in default iphone voice memos app
7586729,,[],[],ios breadcrumb ui control
548935,,[],[],command line interface and ruby client for the tumblr api v
11772649,,[],[],angularjs shopping cart modified to support stripe js includes google wallet and paypal already support
4202722,,[],[],an inbox for your dropbox
36971,,[],[],erlang bittorrent client
8013982,,[],[],not maintained prefer the use of http and and stack gl or gl react a light javascript glsl library for vizualisation and game purposes d or d
6321536,,[],[],cssconsole is a jquery plugin that allows you to transform dom element into console and terminal like input
4118405,,[],[],angularjs features for the intellij platform etc
12199877,,[],[],an example application using wordvec given a list of it finds the one which isn t like the others a typical language understanding evaluation task
1996188,,[],[],popcorn authoring library
3896471,,[],[],a web based compiler for c and vb powered by the roslyn project
4029430,,[],[],this project is closed if i begin it will be from scratch
308649,,[],[],note find the offical repo at http and and github com and robotlegs and swiftsuspenders
1602289,,[],[],cloud foundry the open platform as a service project
7245906,,[],[],a grunt enabled head start with hbp and jquery and modernizr and respond and box sizing border box
8918474,,[],[],a keyboard accessory that blends in with the default ios keyboard
3940296,,[],[],crowd sourced ruby conference wiki
12152452,,[],[],create python web applications for google glass
7581556,,[],[],an ofun prototype of an ultra modern perl 
875389,,[],[],an experiment into open web apps
8181429,,[],[],dump various types of windows credentials without injecting in any process
9284153,,[],[],vertical implementation of android viewpager
10187639,,[],[],store arbitrary data on flickr
600102,,[],[],reusable package level functions that solve common problems
3069882,,[],[],a php implementation of the stack exchange mvc mini profiler
10769528,,[],[],a repository of processing examples for itp fall workshop about face and miscellaneous tracking methods
828109,,[],[],a jquery based alternative facebook multi friend selector that uses the graph api
13214187,,[],[],a tutorial on how to create a off canvas icon navigation with an animated border effect
6427398,,[],[],a javascript library to access mp sources for youtube videos
1893904,,[],[],framework for test driven infrastructure development
11370097,,[],[],an example of how to use the new ios  apis to create custom view controller transitions
6086631,,[],[],a open source remote administrator tool
758689,,[],[],simple lib to track events in mixpanel service it can be used in any rack based framework
14266237,,[],[],this is a mini firewall that completely isolates a target device from the local network
6794164,,[],[],an experimental jquery plugin that will group thumbnails by a shared data attribute into a pile when clicking on the the thumbnails that belong to that pile will be spread into a grid using css transitions
14203,,[],[],restful blog for google app engine
59032,,[],"['gmail', 'gmail-notifier', 'macruby', 'rubycocoa']",a macruby gmail notifier for mac os x
9942958,,[],[],javascript code blocks
2344385,,[],[],apify is a small open source library that delivers new levels of developer productivity by simplifying the creation of restful architectures it helps development teams deliver quality web services and applications in reduced amounts of time if you are familiar with the zend then you already know how to use apify
1725179,,[],[],a home for rich ui components based on knockoutjs
107630,,[],[],the magpie programming language
11863138,,[],[],a simple hello world sender and receiver for chromecast
9051958,,[],[],tool for studying gfw
2814320,,[],"['color-scheme', 'neovim', 'vim']",a vim color scheme with dark and light variants
1281084,,[],[],encode animated gif files on the iphone
9732726,,[],[],visualize when your system was running no longer maintained
