id,summarization,tokens,topics,description
86142,,[],[],is a ruby on rails plugin that allows to save rendered views as pdf documents using the flying saucer java library
250531,,[],[],as port of the soundtouch sound processing library
37573,,[],[],olap extensions for activerecord
130433,,[],[],a port of gheat to a django project
47551,,[],[],simple bdd api for testing asynchronous ruby and eventmachine code
156191,,[],[],home automation using ruby
1036179,,[],[],edit confluence wikis with vim
52098,,[],[],adds translated form labels to rails  
710426,,[],[],a simple read later button for safari
361099,,[],[],the open source ia  emulation project the iphone branch has the isoftcom com cleaned up and with sdk   ethernet may also work the iphone master branch has a port to the current head of master
495209,,[],[],functional reactive programming in ocaml
495544,,[],[],an example rails   web app with subdomains and authentication using devise with a tutorial
824109,,[],[],drag and drop image uploader
383143,,[],[],a python implementation of the double metaphone algorithm
568637,,[],[],a proof of concept full text search engine using mongodb
452298,,[],[],not active an open source platform for d games and virtual worlds
436395,,[],[],a handy tool helping transfer your local rails project to an in one by extracting text from html and helper methods
320446,,[],[],a little iphone tetris game written with cocosd
36462,,[],[],ruby client for hadoop hbase
108825,,[],[],one line tests without the smells
352760,,[],[],using hadoop by ruby supported by jruby not hadoop streaming
124370,,[],[],a rails plugin to read and write couchdb documents via activerecord
52953,,[],[],a haskell web application server
326062,,[],[],a friendly abstraction for coredata
49673,,[],[],auto generate rspec view specs by interrogating your existing views
26192,,[],[],easy access and creation of has many relationships for activerecord models it uses a vertical table so schema changes aren t necessary when you add fields use this plugin to add etc to your models
1033194,,[],[],a python to javascript similar in spirit to coffeescript
183429,,[],[],add support for device gestures to any application
201594,,[],[],facebook connect the run around done in rails
254345,,[],[],expose ruby applications to the web via reversehttp
180718,,[],[],translate vim commands into human readable texts
264331,,[],[],a django rest data api app
864915,,[],[],free cron and background jobs for heroku
1169990,,[],[],infinite scrolling jquery plugin
35450,,[],[],add friendship support to rails apps with this plugin
192203,,[],[],rails plugin to make ajax file uploads just work
967327,,[],[],rock out with your bloch out
135370,,[],[],georgian keyboard javascript library
727574,,[],[],pseudo shoutcast server
45036,,[],[],a ruby and c extension to christian borgelt s apriori item set implementation
47861,,[],[],a powerful charting framework to easily add charts to your rails and merb applications
76590,,[],[],graphical irb like console written using hotcocoa
185941,,[],[],web application for music sharing a personal scalability experiment
277210,,[],[],aqua a ruby object database just add water and couchdb
873461,,[],[],this project implements an stmf based thin client which can send and receive data over read a ps and  and display the contents of a x framebuffer on an ntsc television
1049,,[],[],a jquery plugin for morphic programming
661420,,[],[],simplegeo s fork of python geohash w and east west fixes
591070,,[],[],clone of the align vba since i think vba files are a freaking abomination
250467,,[],[],keepalived conf parser
476714,,[],[],portable jekyll extensions i use for my website to be used with
1114674,,[],[],adobe air based sqlite administration discontinued project
2379,,[],[],replacement for activerecord fixtures using an extremely flexible ruby based approach
60457,,[],[],a django app to export a database dump and media files
72994,,[],[],a dom inspired ruby smart fuzzer
599578,,[],[],twitter s out of forked thrift
73748,,[],[],a textmate bundle to support development of clojure code
300618,,[],[],manage your templates in your database instead of view and with liquid templating support
269133,,[],[],web based application to store processing js sketches and renderings storage and service provided by couchdb
895916,,[],[],the open source python wave client and server solution
1060413,,[],[],a simple addition to uiimage allowing the reflection of images
533163,,[],[],utilities for a widely dispersed replicated redis cluster
204536,,[],[],gem that allows easy production of ruby based projects
68054,,[],[],create pdfs from cucumber features and scenarios for printing
191030,,[],[],code from railsconf  pres building mini google in ruby
245687,,[],[],group support for django extracted from pinax
