id,summarization,tokens,topics,description
629737,,[],[],deprecated add an entire threaded comment system to your rails application with only  lines of code
174407,,[],[],code from fast scrolling in tweetie with uitableview blog post unofficial
16033,,[],[],an update of scott raymond s insanely easy flickr library
170823,,[],[],clojure development library for android devices
168035,,[],[],monitor server cpu and memory and disk usage and url so that you can view those statistics on a web as well as providing an interface to client prorams to read those statistics
387396,,[],[],to keep my study materials
81754,,[],[],rails plugin for picking a non ssl asset host as often as possible
161377,,[],[],harsh another rails syntax highlighter ultraviolet based syntax highlighting for for erb or haml better than the rest
158248,,[],[],sideline is a desktop application that allows advanced searching and monitoring of the twitter public timeline there are two platforms available adobe air and appcelerator titanium
237841,,[],[],maven the definitive guide chinese
680536,,[],[],pure ruby implementation of node js native libraries runs on v and therubyracer
81478,,[],[],people don t give love to automated testing of the frontend i intend to
844223,,[],[],custom uitabbarcontroller for use in iphone applications
19530,,[],[],lightweight rails style mvc router for php
47071,,[],[],a checkout of the faker svn repository at svn and and rubyforge org and var and svn and faker and trunk
222511,,[],[],a nice rubyish interface to the amazon product advertising formerly known as the associates web service and before that the amazon e commerce service
445147,,[],[],swapkit facilitates ipc between iphone applications on iphone os  and later
57425,,[],[],an exceptional tool for creating test data sets using activerecord
493948,,[],[],this repo is the code behind the blog howtonode org
1096293,,[],[],mirror of bitbucket project
495160,,[],[],git mirror of the shflags project by kate ward
30649,,[],[],rails ad server rads is a simple ad server created to manage rotating ads and handling campaign budgets
252642,,[],[],sample code for  days of refactoring series on lostechies com
169136,,[],[],an set of utilities for dealing with java and scala collections
851391,,[],[],examples of writing node js extensions
990349,,[],[],a sliding view of the hacker news front page over time
666648,,[],[],apply a gaussian blur filter to your textures in cocosd
472770,,[],[],simply agile is a scrum like project management tool
609310,,[],[],example of using flask on app engine to make a simple todo list
16636,,[],[],open source gps receiver based on usrp and gns
44842,,[],[],nice dog is a nano web framework for like web py for sinatra or camping for ruby
40724,,[],[],demo application to show rails new in features
71994,,[],[],nginx doesn t generate etags for static content i d like it to let s see if i can remember some c from college
15800,,[],[],various bits and helpers for prototype and that might prove useful or not
76987,,[],[],allows your ruby web app to take custom css rejects anything that smells bad
584506,,[],[],the starting place for every top knotch wordpress theme
23524,,[],[],all of the public erlang and otp source releases since rb  in  in convenient git form
45809,,[],[],chapter source code and example application for grails in action
121443,,[],[],ruby refactoring for using rfactor
321301,,[],[],miscellaneous small jquery plugins and code fragments
401305,,[],[],examples from the professional javascript for web developers
54057,,[],[],paypal plugin for ruby on rails
207539,,[],[],some snippets of vim plugin snipmate vim
21860,,[],[],allows you to generate an activeresource model ready to interact with the you tube api
21688,,[],[],ruby enterprise edition based on mri   
169982,,[],[],spaced repeitition algorithms and mixins e g supermemo algorithm sm 
35883,,[],[],javascript abstract behavior syntax
143239,,[],[],library for accessing plurk s lightcloud distributed key value store for ruby
151805,,[],[],symbol s hot cousin simple and elegant alternative to using method with enumerables
971125,,[],[],convenient api for asynchronous operations in php
234381,,[],[],django couchdb database adapter
389634,,[],[],radial navigator built with processing js
57301,,[],[],a standard library for the v javascript interpreter
73199,,[],[],demo rails application that uses
614506,,[],[],relay is an application for ipad and windows to transfer whatever you re doing on your computer to your ipad and whatever you re doing on your ipad to your computer current clipboard etc are all available for transfer
1092402,,[],[],a recipe for making your uitableview cells smart enough to change their uilabels number of lines and cell height based on the text input to them
683986,,[],[],a ruby library for interacting with an airvideo server
910499,,[],[],s expression source translation and macro expansion utility
35490,,[],[],kawaii is like a web frontend to script and console for your rails with nicely formatted output
200066,,[],[],an xmpp framework in objective c for the cocoa development community the framework can be used for desktop applications or iphone applications
447980,,[],[],integration of jcrop with the django admin
1123488,,[],[],face detection in  pure php
79469,,[],[],is it possible to write tests against css
797893,,[],[],bigdis a file based kv store speaking the redis protocol
117858,,[],[],a simple twitter application built in ruby with sinatra and datamapper
891662,,[],[],a node js full text search library
988670,,[],[],demo photo board application for icodeblog com
32867,,[],[],adds redemption capability to a model for items like invitation etc
248778,,[],[],a django application that uses python   and   features to contact the apple push service as well as maintaining a list of iphone objects and handling feedback from aps
969639,,[],[],data and code for the dataists r recommendation system contest
495283,,[],[],sample netflix like application for books
72502,,[],[],sample code for iphone development
79058,,[],[],tmail is a ruby email handler
37865,,[],[],lucille global illumination renderer
118328,,[],[],rails extensions to simplify internationalization
51168,,[],[],fork of svn and and rubyforge org and var and svn and custom err msg
187742,,[],[],objective c framework for the last fm api
136512,,[],[],nitro web application framework
18307,,[],[],capistrano recipies for god
8659,,[],[],photo gallery management system based on radiant cms ruby on rails
678629,,[],[],an rss parser for node js
85421,,[],[],a collection of django tools which make it easy to change text filled with oembed links into the embedded objects themselves
597300,,[],[],command line nutrient tracking tool
734915,,[],[],an efficient in memory data structure supporting arbitrary boolean queries see readme file below for more information
133775,,[],[],speed and validity test for css dom queries in javascript web frameworks
889889,,[],[],project euler problems solved in python with functional programming style
98107,,[],[],online open source project management system written in php and mysql under the gpl
656203,,[],[],collection of scripts that were once useful for reverse engineering things
127215,,[],[],official espresso php sugar
247273,,[],[],a simple retweet button
401879,,[],[],emacs lisp interpreter in javascript
17165,,[],[],rails plugin that provides the ability to soft delete models
1143897,,[],[],show the differences between json encoded objects
5848,,[],[],archived branches from apache incubator thrift
959236,,[],[],example app using devise roles admin to manage users with cancan
184409,,[],[],version of savage beast that is rails   compatible
143316,,[],[],a github fork of skpsmtpmessage a quick smtp client for the built on cfnetwork in objc
543445,,[],[],example of combining asp net mvc with specflow and watin
881872,,[],[],fork of http and and code google com and p and linux ftools and
370674,,[],[],keep your development machine in sync with production
172775,,[],[],an activerecord query api for replacing sql with awesome
166288,,[],[],short product key generation and validation framework based on elliptic curve digital signatures ecdsa for mac os x and cocoa deprecated
108409,,[],[],note prawn layout has been merged into the main prawn repository as of    http and and github com and sandal and prawn however the stable branch of prawn layout   x is still hosted here
9055,,[],[],ruby bindings for the gtk and port of webkit
1108968,,[],[],hacking of the neato xv  lidar
437164,,[],[],couchdb and node js crazy delicious
192807,,[],[],simple example of using django to work with multiple databases
472205,,[],[],a kohana module for scheduling tasks
224397,,[],[],simple html to epub converter
201217,,[],[],preload and fork ruby interpreter for fast script startup
471683,,[],[],net and clr wrapper for libspotify written in c
809948,,[],[],stealth s bit injectso port
100506,,[],[],a simple ruby solution to displaying addresses
548776,,[],[],a gem providing rails with facebook and delayedjob support
1023249,,[],[],windows phone  ui inspired tile layout concept for web browsers
543398,,[],[],analyzer of django query
261849,,[],[],git demo for windows wpf
650060,,[],[],a simple time tracker for mac os x
713043,,[],[],autocomplete for django taggit
20544,,[],[],notice official repository moved to https and and github com and bbommarito and
412287,,[],[],ruby server to serve web socket requests based on event machine and thin http parser
836894,,[],[],an elisp module that allows you to export orgmode files to markdown
402458,,[],[],source code and supporting content for my ruby manor presentation on data visualisation with ruby
60079,,[],[],warning this repo is not maintained if you want to maintain please send an mail to rails core
392669,,[],[],add non destructive zoom functionaliy to raphael
227304,,[],[],an activerecord pagination gem
12322,,[],[],use jetty to run rails projects
134861,,[],[],jquery plugin for imageless buttons a la google
99869,,[],[],new router for rails tiny  lines fool quick adding routes so fast it hurts and competes with current router otherwise and agile ok it s not more agile but it sounds cool
197410,,[],[],an incredibly simple but fast network message queueing written in python
532194,,[],[],x trace is a tool that provides fine grained visibility into complex distributed systems it can be used by application developers as well as network operators to debug and develop distributed systems
540420,,[],[],an html and css renderer created in actionscript
20548,,[],[],notice official repository moved to https and and github com and bbommarito and
24363,,[],[],dumps yaml fixtures from existing data using activerecord
306406,,[],[],decuda and the cuda binary utilities package low level tools for nvidia g gpus
890162,,[],[],android adbwireless enable adb wireless connection to connect to the phone as if connected by usb
16547,,[],[],rinari is not a rails ide no longer updated see eschulte s fork
30502,,[],[],not maintained gem version of rails plugin
682482,,[],[],a super nintendo emulator for the apple with iphone remote control
132409,,[],[],the authlogic and based authentication and authorization system supported via engines and template of rails
829132,,[],[],face recognition application for mobile phones
166938,,[],[],deprecated the symfony dependency injection container component not maintained anymore see http and and github com and symfony and dependencyinjection
54244,,[],[],semantic web enabled lifestreamer built on rubyonrails
455782,,[],[],an actor library based around redis useful for command and control of distributed ruby processes
73737,,[],[],an application for creating a lifestream with couchdb and django
627811,,[],[],ipad rss reader built on titanium
616534,,[],[],simple opengl es paint iphone application based on apple sample code glpaint
3349,,[],[],tomtt s version of the minor mode for editing rubyonrails code in emacs
244670,,[],[],iphone simulator slow motion superhack
417544,,[],[],a web worker library to distribute work packages to your website visitors
39769,,[],[],sample application for the learning rails free online course in ruby on rails
791450,,[],[],c and cli bindings to webkit and gtk and
332614,,[],[],a browser for cassandra using gtk
71730,,[],[],look here http and and github com and jcrocholl and pep
570132,,[],[],all the ml code examples from the book the little mler
727645,,[],[],helping journalists browse and toy with api data
44155,,[],[],open source rails based content management that works
801246,,[],[],fork of don stewarts hsh haskell shell scripts
39656,,[],[],date and time localization based on rails in functionalities
649275,,[],[],a zzt based massive multiplayer online game built in node js and jquery
48617,,[],[],a ruby vm running on google v super vm
1116505,,[],[],gnustep gui v    w and modifications by sony for snap sdk   
3389,,[],[],a haml scaffolding generator for rspec
31,,[],[],a javascript bdd testing library
117184,,[],[],ruby and rails content management framework
20163,,[],[],a proof of concept tower defense game written in processing js
21922,,[],[],broadcast standard out
838980,,[],[],non plurk fork of solace might eventually be merged back solace is a stackoverflow inspired platform
181823,,[],[],ruby on rails click heatmaps generator
40143,,[],[],a replacement for activerecord that a adds a memcache layer for persistence of the query s cache
386904,,[],[],bithacks h is a c header file containing useful bit manipulation macros
172675,,[],[],bankjob is a command line ruby program for scraping online banking sites and producing statements in ofx open fincancial exchange or csv comma separated values formats
269123,,[],[],an open source spotify client library which is api compatible with libspotify    abandoned in  use libspotify instead
724669,,[],[],python implementation of a network service for generating unique bit ids at scale
360174,,[],[],snippets of useful iphone objective c code
74743,,[],[],a specification framework for lua
381201,,[],[],a cryptographic module for node js
122966,,[],[],a php eval server for erlang and otp
614691,,[],[],an ipaddevcamp winner of the coolest app category april san jose
996782,,[],[],functions and mappings to close open html and xml tags
437109,,[],[],image scaling and serving infrastructure
628889,,[],[],jquery plugin to add a bottom event that will be triggered when the user has scrolled to the bottom or within proximity to the bottom of an element
26481,,[],[],textmate bundle for sproutcore
111448,,[],[],based on the awesome rg by mrn
102899,,[],[],we could develop some interpreter that would be able to parse and process a range of expressions that we might want to deal with this would be quite but also pretty hard martin http and and martinfowler com and apsupp and recurring pdf temporals is a ruby parser for just that
171918,,[],[],ruby bindings for libspotify
450560,,[],[],a blogging framework for node js
73715,,[],[],a twitter client hosted by your local couchdb
145988,,[],[],api ruby e rest para obter informaes de encomendas and sedex dos correios
297574,,[],[],webhooks for django experimental
454781,,[],[],record network requests and responses for easy stubbing of external calls
159506,,[],[],audio library for ruby
244095,,[],[],a much better getbundles bundle for textmate pulls from official textmate textmate review repo and github
537950,,[],[],elegant cassandra php client with timeuuid and supercolumnfamily support port of pycassa
73572,,[],[],a ruby library for quickly creating proxy objects
348255,,[],[],dynamic http routing and load balancing via amqp
624503,,[],[],create an ebook epub of your jekyll blog
474864,,[],[],a simple blog planet for aggregating selected feeds
538,,[],[],ruby port of programming collective intelligence
21180,,[],[],lint for ruby moved to http and and wiki github com and kevinclark and nitpick and
1136409,,[],[],static librarified sbjson
449189,,[],[],webpraca is a opensource job board it s purpose is to provide a way to quickly and easily host a niche job board
20400,,[],[],a fault tolerant distributed lock server in erlang
72821,,[],[],qr code decoding library written in java
13652,,[],[],a rails plugin that provides helpers to highlight code with pretty textmate style highlighting
32692,,[],[],paypal website payments standard extension for the open source shopping cart
297782,,[],[],a rails engine that provides openid support
334936,,[],[],log to firebug or the webkit inspector from any rack app
106087,,[],[],not actively maintained rails plugin and and or ruby gem for benchmarking your test units a rework of the original by topfunky
1045777,,[],[],a distributed key value store for fawn
73087,,[],[],basejs is a work in progress lightweight javascript library for and especially mobile safari be sure to run git submodule init and git submodule update upon first clone of basejs to get sizzle imported
20694,,[],[],fiveruns tuneup panel
111161,,[],[],taka is a dom core and html implementation for ruby
669139,,[],[],a distributed service written on top of node js
6169,,[],[],a no frills merb wiki extracted from wiki merbivore com
95543,,[],[],a ruby library wrapping most of the harvest api
267777,,[],[],solid ruby design principles presentation
9150,,[],[],mash is a hash with the ability to and test for the presence of arbitrary attributes using method calls
346829,,[],[],example code for the accent folding article on ala
213436,,[],[],your on line tool for task management fun
441729,,[],[],browse and manage your mongomapper data using your browser
30110,,[],[],simple tiny pastie clone using sinatra datamapper
52036,,[],[],blank is giraffesoft s blank rails starter app
233036,,[],[],do not use this this repo has moved https and and github com and snorby and snorby
19219,,[],[],examples from the new rd edition of cocoa programming for mac os ported to nu
24724,,[],[],rails plugin my fork from official svn
376721,,[],[],an open source simple game framework that i use for my own games
20872,,[],[],a gem for serializing and deserializing amf messages
111848,,[],[],convert csv files from yodlee or other sources into ofx files for import into other financial software
392963,,[],[],useful wrapper around nsurlconnection that adds many essential methods
22315,,[],[],a rails plugin that handles subdomain accounts
699623,,[],[],a time tested collection of vim settings and plugins
43007,,[],[],library for various machine learning tasks
590814,,[],[],example project for showing a zoomable and movable polyline annotation inside an iphone mapkit view
459464,,[],[],jquery message queuing get all your javascript ducks in a row
328996,,[],"['6502', '6510', 'c64', 'emulator']",a low level commodore  emulator written in actionscript 
327455,,[],[],ruby bindings for devil cross platform image loading library
118801,,[],[],a sample chef recipe repo for learning chef solo
958388,,[],[],category to add an apple style numeric badge to any uiview
305437,,[],[],a geocoder and reverse geocoder sitting atop the corelocation frameworks provided by apple for snow leopard and iphone
58711,,[],[],demonstrates how to configure a rails application to use compass
775085,,[],[],ivy is tim caswell s personal node js fork and customize
260827,,[],[],provides all chinese cities and districts
499710,,[],[],code samples about android drawables
93351,,[],[],a reusable portfolio management project
76009,,[],[],this is a markdown plugin for redmine
237024,,[],[],iphone api for displaying application settings in the iphone application instead of in the settings app nb mysettings is no longer in active development
273156,,[],[],a tiny selector engine only the essentials
4414,,[],[],resource oriented open source ruby framework for web apps
51165,,[],[],startthedark is the product of a series of screencasts by eric florenzano about the django web programming framework the site itself is a place to see what your friends are doing tonight
505194,,[],[],irb on a for macruby and ruby  
30651,,[],[],rails generators which produce tests using shoulda instead of straight up test unit other goodies as well
33783,,[],[],email bounces processing system with rails plugin to prevent rails mailers from sending any messages to a blocked addresses
56835,,[],[],a site wide announcement reusable app for django
93715,,[],[],macruby textmate bundle
308426,,[],[],rfetion is a ruby gem for china mobile fetion service that you can send sms free
571187,,[],[],uki development tools
606437,,[],[],a cron based alternative to running daemons
2582,,[],[],globalite is meant to be a breed of the best in and ln plugins available for rails
408,,[],[],json web app framework not under active development
711302,,[],[],deprecated use https and and github com and googlecloudplatform and google cloud ruby
293655,,[],[],demo of using catransformlayer to create d objects
697482,,[],[],a demo project for the lroauthclient library
199384,,[],[],white house  was a website imagining how the white house would work if it were run democratically by thousands of people on the internet it was an independent effort by jim gilliam created completely outside the u s government this is the source code behind the site which has since taken on a life of its own with a variety of forks and a thriving community in iceland if you would like to get involved in the check out open active democracy for the latest https and and github com and rbjarnason and open active democracy this was originally called nation although it s only connection to nationbuilder com is that it too was started by jim gilliam but is a completely different code base and is going in a different direction
302148,,[],[],a simple way to manage profile based settings in django
774576,,[],[],cakephp support in netbeans
360824,,[],[],ghetto queue support for celery and carrot discontinued use kombu instead
50672,,[],[],a route explorer for rails
193176,,[],[],inlines small partials into templates they are rendered from
1192959,,[],[],hidden kernel mode code execution for bypassing modern anti rootkits
18326,,[],[],twitter client for osx
300689,,[],[],django templatetag for admins to easily change and delete objects from the public facing site
730011,,[],[],cocosd for android is a framework for building d demos and other graphical and interactive applications it is based on the cocosd iphone design it uses the same but instead of using objective it uses java
79924,,[],[],a fork of jan s couchdbx a mac os x wrapper for couchdb experimenting with new features and ui
196857,,[],[],even better than eda reversing i hope
610174,,[],[],notifications system in opengl for cocosd
673086,,[],[],javascript implimentation for messagepack compact serialization format
313493,,[],[],kepler is an open source platform that brings the power of lua to web development
5282,,[],[],an access control plugin for rails
302379,,[],[],a handy collection of and other classes to make life as an ios developer easier
387625,,[],[],an full featured and robust ffi interface to tokyo cabinet
474639,,[],[],a set of zend framework view helpers that automagically and compress your javascript and css
659753,,[],[],a simple split view based filesystem browser for the ipad find out what you can read or write
322394,,[],[],a plugin to duck punch asset packager and provide middleware to work on heroku with a rofs
295977,,[],[],oauth strategy generator for warden authentication framework
667099,,[],[],uitextinput implementation for iphone os   and
1000021,,[],[],an alternative indentation script for python
120444,,[],[],several classes for objective c and cocoa to help write plugins using common scripting languages
483913,,[],[],notice official repository moved to https and and github com and sikachu and verification
190729,,[],[],asmutils is a set of miscellaneous unix utilities written in assembly language
557844,,[],[],an idiomatic scala library for interacting with cassandra
375290,,[],[],monitoring and administration frontend for the rabbitmq server with alice as its restful data source
390989,,[],[],airbrake notifier for rack based frameworks
37363,,[],[],send emails from sinatra in a very simple way
79777,,[],[],sugar for espresso which adds expressionengine template codesense and more
160658,,[],[],an android service that vibrates incoming sms messages in morse code
215689,,[],[],rack upload handler with nginx upload module support
25207,,[],[],tinymce editor with image upload
88973,,[],[],cakephp plugin for acl management
155662,,[],[],miyazakiresistance is a library like activerecord to use tokyo tyrant
180061,,[],[],a simple django application that makes it easy to integrate and use microformats in your web application
676409,,[],[],pokenet in an online tile based role playing game based off the pokemon games
335636,,[],[],note this gem is getting depreciated please see http and and github com and riscfuture and dropbox and dropbox has announced their official api http and and blog dropbox com and p  and this is a simple stop gap ruby api for dropbox
13963,,[],[],rfeedparser is a translation of the universal feed parser from python into ruby it has nearly the exact same behavior
473160,,[],[],tomboy addin for evernote sync
86676,,[],[],use twitter for authentication in django
16813,,[],[],skinny spec is a collection of rspec helper methods designed to help trim the fat and dry up some of the bloat that sometimes results from properly specing your classes and templates
2389,,[],[],customization app for macbooks with multitouch support
43769,,[],[],generic javascript socket api
