id,summarization,tokens,topics,description
184160,,[],[],python implementation of microsoft s net language integrated query linq
157323,,[],[],a collection of ui goodies for iphone
10396,,[],[],rails wrapper for the iui toolkit for building iphone enabled web applications
95840,,[],[],a plugin for growl like functionality for ruby on rails applications built on prototype and scriptaculous javascript libraries
299922,,[],[],add javascript variables and objects to rails projects without ugly js erb stuffed in views
89594,,[],[],beepbeep is a simple web application framework for mochiweb inspired by rails and merb
704320,,[],[],groupon and livingsocial and gilt groupe clone
7927,,[],[],easy creation of facebook applications in ruby using plugin for sinatra web framework that integrates with facebooker gem
455644,,[],[],unofficial mirror of django registration with templates
178986,,[],[],scale your file uploads
1077174,,[],[],massively distributed browser based javascript map reduce framework node js and socket io websockets and webworkers and fun global warming
340502,,[],[],javascript unit tests
466800,,[],[],experimental transform fn method for django for clever lazily evaluated optimisations
212454,,[],[],syntactic sugar for creating python command line scripts by introspecting a function definition
66256,,[],[],varies useful and methods for iphone development
452780,,[],[],local remote resource management for objective c in as little code as possible note currently under heavy so api changes are likely
185029,,[],[],a memcached proxy with energy and pep
206710,,[],[],a rails gem which adds subdomains to route recognition and generation
996852,,[],[],extended matching for and many other languages
124053,,[],[],template scripts for creating new rails applications
74779,,[],[],create virtual ruby and rubygems sandboxes
404180,,[],[],mongodb gui tool based on titanium if you want a native mac version please check http and and github com and bububa and mongohub mac
582640,,[],[],where   workshop code spatial analysis of tweets using python mechanical turk slides here http and and www slideshare net and kevinweil and spatial analytics where  
161753,,[],[],the examples from daniel shiffman s learning processing all done in ruby processing
1127718,,[],[],python graph database implemented on top of redis
301711,,[],[],honeycombs of applications
3511,,[],[],uber lightweight merb blogging engine make sure you check out the feather plugins repo as well
603476,,[],[],aolserver is america online s open source web server aolserver is the backbone of the largest and busiest production environments in the world aolserver is a tcl enabled web server used for large dynamic web sites
5310,,[],[],enables tls on smtp connections for services like gmail
189508,,[],[],rails plugin for integration of the sunspot solr library
201222,,[],[],a lightweight workflow engine application for django based web applications
44936,,[],[],base gem that bootstrap tog platform configuration in a rails app
679651,,[],[],linux port of the spirit jailbreak using libimobiledevice
85024,,[],[],a small library intended to simplify the common steps involved with importing csv files to a usable form in ruby
557024,,[],[],a javascript library delivering various geo tasks like reverse geocoding and content analysis
314062,,[],[],the open source python wave client and server solution legacy version
620492,,[],[],a collaborative drawing app to exemplify using cappuccino with websockets and node js
526651,,[],[],objective c reusable scrollable grid view for cocoa touch modeled after uitableview
381992,,[],[],a streaming compression and gzip library for node js
93563,,[],[],a set of protocol buffers tools and modules for erlang applications
680813,,[],[],deliberate practice lessons for learning the vim editor
842889,,[],[],an embedded ruby web application for remote android device management
515146,,[],[],sample project showing how to create a paging enabled uiscrollview which shows previews of neighbouring content
807764,,[],[],flash and alchemy port of the lightweight shine mp encoder
246690,,[],[],objective c and cocoa touch extensions one might expect to already be there
546053,,[],[],simple facebook integration for nodejs and express
177102,,[],[],rails a rails scaffold generator that generates and more useful code important not maintained anymore
184221,,[],[],dataflow concurrency for ruby inspired by the oz language
140772,,[],[],a tutorial for pyqt focused on showing by doing
127365,,[],[],the diceshaker dice rolling application for android and javascript based for your viewing pleasure
495140,,[],[],javascript back end for ocamlc
48824,,[],[],a faster version of capistrano s deployment strategy
2913,,[],[],open source tumblog and aggregator do not use
59760,,[],[],rspec esque matchers for test unit
67122,,[],[],a plugin to make rails menus easier to write
207709,,[],[],use yuml to generate rails diagrams using railroad and shoes
87656,,[],[],minor mode for editing rubyonrails code in emacs
104802,,[],[],code examples from ruby best practices
230938,,[],[],an interactive tool for constructing three s ttstyle rendering pipelines
132922,,[],[],open sourced version of a simple help ticket system that we use at big folio and nextproof
261831,,[],[],a set of paster templates for django including a fabric deployment script
263209,,[],[],the postgres backend protocol implemented in pure js for use with node js
992137,,[],[],translate jquery api into chinese
59112,,[],[],a super tight library to add contexts to tests
122844,,[],[],pure ruby general purpose router with interfaces for email or choose your own adventure
99638,,[],[],c based oo portable data structure library
10923,,[],[],parallel and distributed test runner for ruby
681076,,[],[],javascript library to pack primitives to octet packaged for nodejs
275097,,[],[],curated collection of all the sweet django helpers and utilities developers and sometimes recreate too often
556422,,[],[],a utility for grabbing tv and radio from bbc iplayer phil lewis has stopped developed it so i ve forked it
208496,,[],[],a real time couchdb chat demo
293370,,[],[],security infrastructure library for nhibernate
3653,,[],[],piston is a utility that eases vendor branch management this repository is a complete reimplementation of piston to provide different depending on the repositories and working copies you pistonize from
602355,,[],[],microsoft directui documentation
252780,,[],[],use the observer pattern to better divide your objects responsibilities
52888,,[],[],port of practical common lisp samples to clojure
365682,,[],[],html editor for the liquid language syntax basic error checking etc
577412,,[],[],no need for keynote or powerpoint use a browser to give presentations
13193,,[],[],a rails plugin to make creating a wizard easy and with a lot less code
157744,,[],[],a rails metal handler for analyzing your processes memory usage
285784,,[],[],visual knowledge browser
743404,,[],[],track of tiny c compiler
96228,,[],[],nonviral cocoa source for implementing an application feedback panel for feature requests and support
54788,,[],[],find likely mass assignment vulnerabilities
299625,,[],[],easy swfupload integration into rails application including session support
53269,,[],[],fork of scott rutherford s excellent fckeditor rails with easy upload image plugin of alfonso martnez de lizarrondo
72870,,[],[],rails scaffold generator that outputs haml and better functional tests
74834,,[],[],deploy rails applications automatically by running capistrano tasks with git post commit hooks
147868,,[],[],edit and display links to your online social network profiles
8136,,[],[],fork of plugin for rails
868641,,[],[],a set of classes to create and manage the apple push notifications lifecycle
170749,,[],[],clojure library to make life on google appengine clean and easy
55690,,[],[],pastebin built using dojo for ui elements
587600,,[],[],a sample gizzard application
619326,,[],[],a simple uiview wrapper for cagradientlayer for the times when it s more convenient to use a view instead of a calayer
242189,,[],[],jquery haml is a haml like language written in json this allows for easy dom building so that web apps can do more work independent of the server for a better user experience
252009,,[],[],bowline twitter client
60537,,[],[],the new version of amsn client
104878,,[],[],json parser that understands cross references and casts to typed ruby objects implements jsonquery against json trees and ruby object graphs
700618,,[],[],a simple utility to handle the activation process for iphones
248869,,[],[],using amqp as a queuing backend for web apps should be easy
216936,,[],[],threads that won t die when the process does yay
37347,,[],[],is a plugin in that makes stripping and sanitizing html stupid simple install and forget and forget about forgetting to h your because you won t need to anymore
251382,,[],[],run your tests in parallel processes
1041062,,[],[],experimental javascript to arduino i and o implemented as a wrapper for the asglue library rube goldberg esque stack javascript flash socket and serial proxy arduino usb next steps and fork ideas nodejs and websocket instead of socket proxy and flash
64764,,[],[],a webbased application that let s you play tracks from the cloud straight from your desktop
1176084,,[],[],providing a calendar widget and event creation for iphone
158244,,[],[],a simple json parser in objective c
96305,,[],[],stand minimalistic blogging engine powered by the ocsigen web server and framework for ocaml
164668,,[],[],emacs init file and plugins to enhance ruby on rails development experience
389082,,[],[],java example domain driven design command query responsibility separation
1096957,,[],[],opengl based ansi c implementation of the openvg standard
191763,,[],[],a geographical community site for django developers
104505,,[],[],an erlang memcached client
103635,,[],[],various objective c utilities originally pulled from the objectiveresource but now having a more utilitarian slant
370746,,[],[],a library for simple histograms in django s admin
504352,,[],[],hbase as the backing store for the tf idf representations for lucene
590269,,[],[],the totally denied python microframework for scaling enthusiasts
366970,,[],[],ruby on rails plugin for shrinking javascript assets using the google closure compiler
341075,,[],[],easier django logging
648898,,[],[],cmu sphinx speech recognition toolkit
166466,,[],[],an xcode plug in to perform automatic pairing of message brackets
19069,,[],[],rails plugin for cleanly modeling social networks using activerecord
49932,,[],[],ruby linear algebra library
921250,,[],[],memoryleakchecker can check for data structure memory leaks in javascript
105195,,[],[],ebook programming pearls rewritten in ruby
273212,,[],[],git mirror of php fpm
347712,,[],[],icy is a lightweight dpkg based installer for the iphone
7205,,[],[],a comment spam solution that doesn t rely on or external web services in other a comment spam solution that doesn t suck
836855,,[],[],procedural planet generator
862584,,[],[],code from my sf django meetup presentation on  and  and 
853504,,[],[],storekit in app purchase module for titanium mobile iphone
130972,,[],[],ruby and rubycocoa for the iphone sdk
356843,,[],[],an example xcode project to create pdf files on iphone device with libharu
31902,,[],[],the uberkit is a rails plugin with a set of ui tools to ease common development
958426,,[],[],javascript webp library
972790,,[],[],putty enhanced with the ability to connect to android debug bridge
12605,,[],[],github blog badges for everyone
457303,,[],[],this project is obsolete use the asset pipeline now built into rails instead
889408,,[],[],rack version for the socket io server side just like socket io node an unofficial implementation
26914,,[],[],ghost game host a dedicated warcraft iii game host for battle net and pvpgn
464140,,[],[],a php module that incorporates all known apis that map an email address to user information
902860,,[],[],angel simple javascript canvas tutorial sources
44033,,[],[],a collection of utilitarian named scopes for your activerecord models
36481,,[],[],a gitified copy of peter cooper s rubyflow website
678815,,[],[],coretext framework example for ipad iphone
223758,,[],[],an example iphone app which uses gambit scheme
55019,,[],[],github for the iphone
332043,,[],[],a pickled object field for django
777376,,[],[],an apple sample project to demonstrate reading pdf metadata with coregraphcis i have update the project to compile in the   sdk
449999,,[],[],chili is the jquery code highlighter plugin
791454,,[],[],winforms samples for use with mono s implementation of system windows forms
133160,,[],[],extensions to prototype to aid in writing unobstrusive javascript
735727,,[],[],dsniff is a collection of tools for network auditing and penetration testing
91259,,[],[],simple graphs using jquery and raphael
488739,,[],[],chinese go programming language user group
1160491,,[],[],paypal express checkout implementation in php
513109,,[],[],an open source notepad application for iphone
699431,,[],[],legacy mirror please use https and and github com and loved and love instead
1096695,,[],[],ios view controller tree for presenting a text font and size and colour picker to user
42068,,[],[],a collection of high level non blocking io libraries
223986,,[],[],an activerecord database adapter that allows you to setup a master and slave environment
597315,,[],[],rails user demographics collection and searching
402149,,[],[],palm pre style application switcher for iphone os abandoned
6388,,[],[],a better version of this functionality is in rails   use that
928246,,[],[],messagepack javascript implementation
355490,,[],[],this is a skeleton application that creates an android service in c and and accessing it via java and binder
8268,,[],[],a plugin for creating psuedo scheduled jobs in ruby on rails
1055423,,[],[],uitableviewcell subclass whose contentview can slide out to reveal another as seen in the facebook scvngr and twitter app
262679,,[],[],a sweet unobtrusive javascript framework for jquery and rails
334372,,[],[],couchdb in the browser
9129,,[],[],running long background tasks in ruby on rails made dead simple
36165,,[],[],relaxdb provides a simple ruby interface to couchdb
772181,,[],[],request per second and sqlop per second monitoring for using redis for storage
520273,,[],[],rtmp server and client written by c
523767,,[],[],this is the source code referenced in the o reilly online course developing android applications with java more information can be found here http and and training oreilly com and androidapps java and
303953,,[],[],hurricane is a project for easily creating comet web applications
162047,,[],[],a bdd testing framework for ruby that s mad at the world and plans to kick it s ass in  freakin lines of code
211831,,[],[],inject code into a running process
344846,,[],[],wrapper of mongodb database for commonjs
212215,,[],[],interactive programming notebook for the web browser
216981,,[],[],cocoa app for creating and editing gists written in macruby
1003716,,[],[],eclipse like task list
18287,,[],[],makes amazon s backups redonkulous redonkulously that is
189745,,[],[],port of iphone s uikit for mac os x
4574,,[],[],hemingway is a template for wordpress
622654,,[],[],jefe is a safe sandbox for running user scripts in node js
479033,,[],[],doublehelix obfuscates ruby codes in double helix style
103634,,[],[],an abstraction of the various synchronization policies used when linking a remote iphone app to a supporting backend web service abstracted from the objectiveresource project
389891,,[],[],droidex android projector
105254,,[],[],a grand unified mapper for rack
279992,,[],[],simple sinatra app for one click capistrano deployments
88549,,[],[],a handful but hopefully growing amount of scrubyt examples
19556,,[],[],user interface components for prototype js
388951,,[],[],a framework of useful actionscript classes
341164,,[],[],spree extension for hosting spree on heroku
808243,,[],[],explorations relative to cloning flumejava
943927,,[],[],sample application using ravendb and asp net mvc written using a test first approach with nunit and moq with structuremap as an ioc container and fluentvalidation for validation a cqrs demo with a single this has been built for a blog series found at http and and codeofrob com and
134999,,[],[],cherly sher lee is an in vm caching library for erlang
436579,,[],[],railslist is a craigslist clone
74491,,[],[],jazzrecord is an activerecord orm for javascript
73046,,[],[],python bindings for the firmata protocol
165171,,[],[],simple sinatra based micro blog and twitter clone
923770,,[],[],minecraft server in node js
34419,,[],[],a collection of yasnippets snippet definitions for use with ruby on rails
478179,,[],[],a cocoa application to demonstrate the interaction between objective c and javascript in a webview
161550,,[],[],sms on rails provides your app with instant sms integration
260744,,[],[],asynchronous programming library for cocoa and cocoa touch
839038,,[],[],source code for fedena version  
108382,,[],[],a jquery plugin that will populate form inputs with text that disappears when the field is focussed
863857,,[],[],a simple racing game inspired by the classic lotus series on amiga this has been made for the k apart contest http and and k aneventapart com you can play live at
612335,,[],[],fontue is a rack open web font server built for kernest com this project also includes font optimization scripts for use with fontforge
204622,,[],[],our collection of standard capistrano all rolled into one place
544760,,[],[],a simple script to crawl google profile pages and extract their information as structured data
460905,,[],[],a sexy sequential ajax sajax javascript library for jquery
97159,,[],[],no longer maintained these capistrano recipes allow you to setup a machine running ubuntu server    or   they will install and setup ruby and ruby enterprise edition phusion and git
182743,,[],[],ruby bindings for cocosd iphone a k a i want to program my iphone game in ruby
173207,,[],[],a pure ruby reactor library
333739,,[],[],personal url shortening with couchdb
722868,,[],[],how to implement most common design patterns using ruby
63559,,[],[],a jquery plugin that adds spellcheck support to inputs using the google spell checker api
358463,,[],[],we often discover simple solution while working on our games and apps for iphone
180341,,[],[],package a couchdb installation on mac os x with any erlang and couchdb version
350231,,[],[],lazily parallelizable python pipeline
608409,,[],[],a framework of re usable components for happier iphone os development
919166,,[],[],scxib interface builder for the web
62726,,[],[],a reusable newsletter subscription opt in and out application
40590,,[],[],a lightweight high performance http server library for c
16330,,[],[],allows user owned tags for multiple and makes tags easier to work with
466757,,[],[],nginx module providing api to communicate with supervisord and manage start and stop backends on demand
137181,,[],[],keywurl only supports safari  x and earlier and is therefore deprecated
16463,,[],[],textmate bundle for ruby shoulda gem and rails plugin
659041,,[],[],a fully customizable tab bar for cocoa
504711,,[],[],import an excel file using ruby
28820,,[],[],old repository please see http and and github com and twitterr and twitterr core for latest official repository for project twitterr the most ruby like bindings for the twitter com rest api by a long way anyone want to take over i don t have time for ruby oss projects any more
855985,,[],[],store js and css in compressed pngs
141298,,[],[],namespace js is a small javascript script which provide namespacing utilities it is framework independent it also allows you to remotely include files
797356,,[],[],like sinatra but in php
365177,,[],[],javascript unit testing
60276,,[],[],csshttprequest is cross domain ajax using css as a transport
989440,,[],[],an example of real time collaborative web app using websockets and knockout
37736,,[],[],this is another erlang couchdb client it is a little simpler than most and does what i want
127,,[],[],mofo was a fast and simple microformat based on a concise dsl and hpricot no longer maintained
140258,,[],[],an iphone app to view articles on wikihow com
173845,,[],[],the embedded disassembler
29614,,[],[],this plugin when used in conjunction with the paperclip file attachment plugin allows you to attach more than one file to the model this project is no longer maintained and it is looking for a good home
259572,,[],[],a simple continuous integration written in python
327618,,[],[],a collection of extensions for the cappuccino application framework
78839,,[],[],objective c version of apache lucene this is a fork from the http and and etoileos com project
3781,,[],[],is it down for or just me
50144,,[],[],a distributed key value storage system designed for persistent
410,,[],[],cruisecontrol rb is a continuous integration written in ruby it is quick to simple to use and easy to hack
412309,,[],[],an app to add object level and row level permissions to users and groups each model can have different permissions
345003,,[],[],an xml validation based trace validator
665245,,[],[],filesystem backed by riak
818,,[],[],strokedb is an embeddable distributed document database written in ruby
446850,,[],[],piglet is a dsl for writing pig scripts in ruby
1123232,,[],[],jquery autocomplete plugin
55317,,[],[],git implementation in objective c
81461,,[],[],githubbub a github fluid userscript growl and dock and more
12513,,[],[],a purely python implemented irc bot framework
134391,,[],[],this is a session backend for django that stores sessions in a tokyo cabinet which communicates via tokyo tyrant using the pytyrant library tokyo cabinet is a key value store similar to bdb
61705,,[],[],mirror of drupal core from cvs uses deprecated we recommend you use http and and github com and drupal and drupal instead of this repo
725383,,[],[],github upload of bill mcneal s ruby wrapper for stanford s nlp library
88982,,[],[],a lightweight apache module for perl scripts
152972,,[],[],a dsl for building and executing ffmpeg commands
66016,,[],[],a db interface written in rails
191406,,[],[],collection of jquery plugins
272302,,[],[],bookmarklet for listing global variables helps prevent accidental leaks
464074,,[],[],simple epub book reader for the iphone
64150,,[],[],a rails plugin that adds the ability to automatically stamp each record with the currently logged in user
135704,,[],[],a rails project to demonstrate cells in action
209468,,[],[],iphone do not use for inspiration look at cocoalibspotify open source spotify client the project is very very dead
401565,,[],[],monitor individual aspects of your rails application s health
21096,,[],[],the source code repository for twoorl com
796441,,[],[],a build of zebra crossing http and and code google com and p and zxing and for ios 
228096,,[],[],simple sinatra facebook extension in  lines of ruby
45712,,[],[],base rails app with email login instead of username bort programmed to feel pain
321987,,[],[],bypass gfw s blockade on almost every browser
196236,,[],[],full text searching on google appengine
10437,,[],[],a data munging and reporting library for ruby
12603,,[],[],edit in place plugin for jrails
81638,,[],[],please note this project has not been adapted to rails sorry generate full featured scaffolds using the extjs framework
312069,,[],[],concurrence is a framework for creating massively concurrent network applications in python it takes a lightweight tasks with message passing approach to concurrency the goal of concurrence is to provide an easier programming model for writing high performance network applications than existing solutions multi asyncore etc
30753,,[],[],want to write iphone apps with unit tests want to write them in ruby
925206,,[],[],control your arduino with node
239166,,[],[],simple full text search demo for google app engine
532245,,[],[],javascript tools for css transition timing functions cubic bezier functions
213676,,[],[],ruby client for google wave
584429,,[],[],a django microframework that eases the generation of aggregate data for querysets
39322,,[],[],easy editing in place for restful web apps
85332,,[],[],jreversepro java decompiler
219814,,[],[],open source python library for accessing amazon simpledb api
922661,,[],[],add keyword and regular expression suggestions for tags
17792,,[],[],plugin for autocomplete python code on gedit
131797,,[],[],a complete reimplementation of the gem server command as a sinatra application
40034,,[],[],a simple dsl for creating jabber agents
1079574,,[],[],demos for ofxkinect kinect openframeworks addons
127112,,[],[],ruby hacking guide english translation
1058729,,[],[],c and c and and omni completion with ctags database
277394,,[],[],script for saving a json archive of your tweets
31791,,[],[],a twitter xmpp gateway with search and track and other good stuff
922136,,[],[],ios uitableviewcell that automatically adjusts its height as you enter text
17935,,[],[],ruby on rails plugin css and js asset bundling in  seconds or less
305158,,[],[],couchdb based git server
206812,,[],[],graphite and rabbitmq integration scripts
188999,,[],[],a simple piglatin app to show off sinatra and dj
33325,,[],[],an activerecord adapter for the salesforce com api
323412,,[],[],gaeutilities a collection of utilities to help with application development on google appengine
