id,summarization,tokens,topics,description
794632,,[],[],inception movie explained programmatically
358091,,[],[],emile js is a no frills stand alone css animation javascript named after mile early animator
67179,,[],[],natsuliphone the twitter client for iphone and ipod touch
18944,,[],[],sproutcore has moved http and and github com and sproutcore and sproutcore
511859,,[],[],javascript and dom in your the simple way
438706,,[],[],norbert is a cluster manager and networking layer built on top of zookeeper
709474,,[],[],a series of codes i ported to jquery from dojo
3010,,[],[],erlectricity exposes ruby to erlang and vice versa
298018,,[],[],cocoa meets webkit for more rapid ui development
859318,,[],[],mirror the display of an ios device on an external screen
804556,,[],[],the amazingly simple to real collaborative todo list
240413,,[],[],this plugin enables enterprise class google sitemaps to be easily generated for a rails site as a rake using a simple rails routes like dsl it allows you to take care of familiar sitemap issues like gzip of sitemap variable priority paging and sorting links e g page  ssl host links e g https rails apps which are installed on a sub path e g example com and and and hidden ajax routes it includes a sitemap index file so it supports more than the standard individual urls up to a maximum of   billion and pings all major search engines on completion sitemapwriter
774415,,[],[],simple ruby style inheritance for javascript
1080006,,[],[],simple web scraping for google chrome
346619,,[],[],rack middleware replacement for
1017999,,[],[],the modernizr server library is a way to bring modernizr browser data to your server scripting environment php currently but other server side environments to come and subject to demand
573477,,[],[],build scripts for building ffmpeg on iphone
938350,,[],[],realtime apps made easy with templating
15536,,[],[],this repository moved to http and and github com and ramaze and ramaze
281736,,[],[],a fuse wrapper around mongodb s gridfs
327499,,[],[],the reference implementation of orderly a schema language for json
830608,,[],[],it s like sinatra in c
595812,,[],[],generate temporary mail aliases for throwaway purposes this is the full code behind the tempalias com web service
382059,,[],[],a redis implementation in node js
960977,,[],[],library for reading and writing midi files in javascript
358868,,[],[],your source for event drivenness
511871,,[],[],harmony plugin for ruby on rails tests
861851,,[],[],javascript benchmark testing
559965,,[],[],an implementation of the webworker api for node js
336217,,[],[],rails plugin for the jquery datatables library
74399,,[],[],a simple gitweb replacement built with django
570181,,[],[],an attempt to come up with a sane web api to core data synching using the pivotal tracker api
233782,,[],[],git based blog and cms for meant as a replacement for wordpress
393556,,[],[],see the link below for the most up to date code
388972,,[],[],a simple wiki developed using node redis node client and showdown
403262,,[],[],dbslayer mysql support for node js
204095,,[],[],a simple ab testing app for django
236834,,[],[],a couchdb interface for node js
141175,,[],[],asynchronous http request dispatcher for webhooks
1062759,,[],[],a collection of nifty tools for titanium mobile
260449,,[],[],static is a super simple rails cms for heroku
45492,,[],[],the official selenium on rails synced with openqa
241819,,[],[],quickly post photos from your mobile device to twitter
583739,,[],[],procedural drawing tool my fork reduces it down to be integrated elsewhere
190617,,[],[],a rails plugin for connecting to and working with couchdb via couchrest
182256,,[],[],an easy direct erlang couchdb library
464711,,[],[],track what users are on which pages with redis
596888,,[],[],a high level cassandra object abstraction for python
210090,,[],[],a couchapp that lets you give a presentation by rotating and zooming in an svg and png and pdf file
683430,,[],[],mootools menu reveals more of the image as you rollover it
539936,,[],[],check your website if it is seo
906913,,[],[],easy twitter integration for devise
512932,,[],[],obsolete pure javascript mysql network driver for node js
177285,,[],"['obsolete', 'rubygems', 'unmaintained']",retired openpgp rb is a pure ruby implementation of the openpgp message format rfc 
1094909,,[],[],an insane integration of rdf in to ecmascript  v javascript
927229,,[],[],set of rails helpers for unobtrusive frontend validations using html rails  validators and javascript
98355,,[],[],a collection of rails templates i use for projects
508918,,[],[],lightweight realtime task tracking as a couchapp
495517,,[],[],rest ful web framework in agda
19029,,[],[],a flexible database focused on performance and scalability
133522,,[],[],command line json pretty printer
13458,,[],[],the official ruby library for interacting with the lighthouse api
649987,,[],[],a basic template for building a brand new gem
566380,,[],[],mootools lightbox plugin that supports a wide variety of media
860467,,[],[],javascript animation library
588560,,[],[],document clustering based on latent semantic analysis
810169,,[],[],a node js framework that glues together and things designed to help tim allen navigate his day
432360,,[],[],asynchronous and multiplexing fastcgi for nginx incl ref server implementation
575625,,[],[],procedural drawing tool
1175874,,[],[],a bookmarking site using appengine and tornado with delicious import feature
103370,,[],[],error logging and notifications
965306,,[],[],better js language syntax file for textmate
439162,,[],[],a little known and unreleased iphone web app javascript framework developed by apple
452040,,[],[],a multilingual human readable markdown reference you can include in your projects
739961,,[],[],i feel this is outdated look for something else it is a way to watch all js files if they have been changed and to restart nodejs it allows easy development and stable production
480897,,[],"['obsolete', 'rubygems', 'unmaintained']",retired php rb translates ruby code into php code
781771,,[],[],conditionally roll out features with redis python version of james golick s http and and github com and jamesgolick and rollout
668965,,[],[],an asterisk module for node js
444244,,[],[],erlang bert encoder and decoder
348037,,[],[],sailing the waves of google with ruby
671314,,[],[],a python fuse file system that features transparent deduplication and compression which make it ideal for archiving backups
867639,,[],[],a collaborative bdd project planning tool for node uses kyuri and vowsjs
922371,,[],[],my explorations in natural language processing
611327,,[],[],an extensible network service container for node js
30288,,[],[],an objective c and foundation implementation of the git version control software
1079662,,[],[],linux port of original windows code from olga barinova
531480,,[],[],publish google forms with your own custom theme via a simple rails application that does everything for you
549905,,[],[],a lightweight ruby object persistence library for mongo db
746164,,[],[],implementation of the friendfeed schema less mysql pattern
688960,,[],[],work on class based now part of django   for a backport to django  see https and and github com and sorl and django cbv
381898,,[],[],version control in ruby mercurial compatible big ideas
264147,,[],[],the tiny command line interface library with lots of style
167391,,[],[],sproutcore   build tools
3273,,[],[],capistrano plugins and templates
676937,,[],[],an achievement system generator for rails
379100,,[],[],deprecated please see new home on d o
263972,,[],[],do not use use mongodb and it s speed to do basic analytics tracking in rails
841121,,[],[],goneedle is a system for punching reliable transport over udp through nats and firewalls
658073,,[],[],round robin database pattern via redis sorted sets
476523,,[],[],a search engine built on top of couchdb lucene
514331,,[],[],admin module for the kohana framework ko
1021047,,[],[],a very simplistic command line to do and notes list manager in ruby
222572,,[],[],how did these breadcrumbs in your rails application oh with this plugin
717866,,[],[],a simple python and asyncore websocket client library primarily maintaining compatibility with the tornado implementation
35888,,[],[],microblogging using rabbitmq and ejabberd
375017,,[],[],generate css sprites automagically a work in progress
361256,,[],[],help dan north has kidnapped me and is making me create a bdd framework in clojure
384538,,[],[],an extensible cms written in kohana 
300121,,[],[],http based console and object explorer for node js
1070874,,[],[],high performance pattern matching on large sets of patterns in node js
1073086,,[],[],cpu usage streaming and event notification service for node js
590273,,[],[],an interactive tutorial for a git branching model
452582,,[],[],an asynchronous erb like template engine for node js
1049901,,[],[],rack middleware for bring modernizr server side
353719,,[],[],when all you need is assert
908618,,[],[],textmate plugin that enables you to edit files in fullscreen mode for native os x lion fullscreen support see https and and github com and enormego and egotextmatefullscreen
374148,,[],[],abandoned mapreduce api for mongodb
182766,,[],[],ruby metaprogramming study note
529597,,[],[],a simple fitbit api client
1009227,,[],[],automatically scrobble your vinyl collection in real time
936908,,[],[],the iphone native version of js console with websocket support
323654,,[],[],a class for working with couchdb documents from cappuccino and objective j
1146748,,[],[],simple javascript framework for building rias with jquery
728118,,[],[],a port of the boxdjs library into a nodejs module
707066,,[],[],a native javascript implementation of scummvm
62230,,[],[],you should probably use heroku instead
667429,,[],[],a binding between node js the v engine and python super beta super buggy super great
811201,,[],[],command line interface for browsing reddit com
179221,,[],[],web scripting in the cloud
519087,,[],[],an actionscript mapping framework for data visualization
1140869,,[],[],diaspora branch with xmpp federation support
368157,,[],[],textmate bundle for cappuccino and objective j
51785,,[],[],implementation of a bosh client using jquery
751444,,[],[],a bit torrent client written in on top of node js
722420,,[],[],coroutine utilities for non blocking i and o with greenlet
306241,,[],[],a light extension for using redis with sinatra
975438,,[],[],a command line tool that automates the task of creating a git mirror for a svn and keeping it up to date
1101604,,[],[],css transitions and transforms with javascript
817045,,[],[],custom error pages for rails
797350,,[],[],facebook php sdk helper for kohana 
797501,,[],[],admob module for titanium mobile iphone
647010,,[],[],voicemail for hackers
334110,,[],[],simple multinode couchdb proxy
257463,,[],[],universal soundcloud api wrapper for flex and air written in actionscript   please report any bugs in the issues section
834556,,[],[],simple ip to lat and long api application using the maxmind geolite database
22466,,[],[],ruby binding to the xiaonei api
363827,,[],[],implementation of paypal apis in python canonical repository is at duointeractive and paypal python
221598,,[],[],automated jquery tests with qunit
649306,,[],[],reflexive is a web based live class and source code browser
276093,,[],[],deprecated please see new home on d o
746247,,[],[],objective c wrapper around twitpic s oauth and oauth echo api with oauthconsumer lib deprecated
114680,,[],[],an experiment in creating an oauth provider with sinatra
395570,,[],[],minimalist music player for os x
333443,,[],[],code for the sammy tutorial series
621177,,[],[],a port of the rails and activesupport inflector to javascript
276066,,[],[],a tiny restful modem server
89363,,[],[],where i grow clojure codes
819266,,[],[],irc interface for stack overflow chat
1076029,,[],[],mirah android app generator also see https and and github com and mirah and pindah
365830,,[],[],a tiny javascript and flash library that enables the creation and download of text files without server interaction
301504,,[],[],an objective c augmented reality kit for iphone
5964,,[],[],self assembling fabric of ruby daemons
25856,,[],[],jrails is a drop in jquery replacement for prototype and script aculo us on rails using you can get all of the same default rails helpers for javascript functionality using the lighter jquery library
631474,,[],[],content integration framework document extraction and retrieval a document parser framework that stores parsed entities into jena http and and jena sourceforge net and rdf vocabularies and provides knowledge base enhanced semantic ananlysis of content annotated content can be used by search engines to present content navigation which will be implemented in the yacy search engine
71143,,[],[],an example rails app using the authlogic authentication library
267286,,[],[],a driver written in c to connect to the mongodb document oriented database
92869,,[],[],rails saas and sso solution
83992,,[],[],a library of neat rails application templates
158886,,[],[],a powerful web application framework based on the groovy language
336763,,[],[],a project for porting and optimizing opencv for google s android os
71699,,[],[],the blog that s almost nothing
798870,,[],[],timeline visualization application
26,,[],[],merb core all you need none you don t
246271,,[],[],an open source q a question and answer eco system
363916,,[],[],flip is a jquery plugin that enables card flip animations with only css animation
6275,,[],[],open source dynamo clone written in erlang
123328,,[],[],standard authentication stack for rails using twitter to log in
314189,,[],[],an implementation of the advanced encryption standard aes algorithm meant for study to go along with a stick figure guide to the advanced encryption standard aes blog post at www moserware com
119526,,[],[],fetch exactly what you need
38151,,[],[],collaborative filtering for rails
38454,,[],[],a featureful rails plugin leveraging the new kickass prawn library to produce compiled pdf views
484284,,[],[],this is a suicide mission it will almost certainly fail but it can t hurt
65085,,[],[],a simple to learn and yet powerful web scraping toolkit
698445,,[],[],the nytimes document viewer
520887,,[],[],do is a simple library for managing async actions in node js
188277,,[],[],an open source cover flow implementation
16898,,[],[],ack in project textmate bundle
2296,,[],[],james conroy finn is the new maintainer please visit his repository http and and github com and jcf and git tmbundle for the new official home of the git textmate bundle thank you
21012,,[],[],serve git and advertise with bonjour
801545,,[],[],a standalone version of google s new rich text kix
346738,,[],[],jquery dotimeout like but better
20550,,[],[],notice official repository moved to https and and github com and amerine and
187180,,[],[],a cookbook for the vim text editor
36517,,[],[],ec on rails deploy a ruby on rails app on ec in five minutes
620669,,[],[],an ios opensource framework for supporting drag drop within an application and between applications
463068,,[],[],mumblr is a basic django tumblelog application that uses mongodb
1014524,,[],[],convert or render graphs as svg or via graphviz
4078,,[],[],ruby library for consuming yahoo flickr and windows live contact apis
1954,,[],[],a mirror of the mephisto code base
2370,,[],[],activerecord connection proxy for master and slave connections
1205535,,[],[],screen capture for android
93,,[],[],ghost from christmas past unmaintained
67978,,[],[],minimalist blogging engine without textareas based on sinatra and git push hooks
699254,,[],[],a simple javascript multivariate testing framework
694674,,[],[],node js and php realtime browser based chat app supporting multiple rooms based on ry and
237103,,[],[],monitoring and rest interface to rabbitmq
318157,,[],[],use any html template as a theme generator for your rails app
336655,,[],[],a real time d engine for flash player 
13960,,[],[],more than just a new rdoc template
67787,,[],[],the official fork is now maintained by benprew in http and and github com and benprew and pony
729646,,[],[],cljr is a clojure repl and package management system
52796,,[],[],a common sense cms from the media collective
99639,,[],[],c multiplatform coroutine implementation via fibers or setjmp
16966,,[],[],a ruby state machine like assm and but with a more sensible api in my opinion
367645,,[],[],source code for the growing object oriented guided by tests
237376,,[],[],dynamic reporting engine for ruby rails
18966,,[],[],sample applications for the sproutcore javascript framework
732488,,[],[],yeah i m getting tired of the long description
299327,,[],[],a game where players programm agents that compete for resources in a simulated environment
20559,,[],[],notice official repository moved to https and and github com and amerine and
549638,,[],[],a simple jquery plugin to easily map keyboard characters to links or functions
39705,,[],[],a firebug extension for javascript testing
503270,,[],[],an agreeable way to talk to your database
160773,,[],[],a blog written in clojure using compojure
236763,,[],[],a plugin for rails    applications which switches the default to escape by default later versions should use rails and
260417,,[],[],a jquery plugin for extracting metadata from dom elements
126720,,[],[],flicktabcontrol is an easy to use library of the flick tab originally inspired by the implementation of tabbing in facebook s iphone application tags c
10344,,[],[],sharding support for activerecord  x
61337,,[],[],a vim script that extends the fuzzyfinder plugin to support textmate style file searches e g cmd t unmaintained see http and and weblog jamisbuck org and  and  and  and the future of fuzzyfinder textmate
20553,,[],[],notice official repository moved to https and and github com and david kerins and
23267,,[],[],a pure javascript browser environment
228144,,[],[],an objective c wrapper for embedding the mongoose http web server in iphone apps
218,,[],[],merb plugins even more modules to hook up your merb installation
118301,,[],[],crm cms and integrated business management platform built in ruby
50076,,[],[],paradigms of artificial intelligence programming in ruby
540012,,[],[],a collection of libraries in objective c for working with twitter s xauth implementation
189821,,[],[],some examples of transparently caching things in django
10272,,[],[],copy as rtf a textmate bundle to make copying syntax highlighted text into etc easy peasy
352169,,[],[],a find in project plugin for textmate
121407,,[],[],couchfoo provides an activerecord api interface to couchdb
647068,,[],[],emacs and slime and common lisp in one easy to install package
2782,,[],[],a jquery plugin to ease the development of dynamic html wireframes with state
488724,,[],[],umekit a port of uikit for mac os x desktop
6665,,[],[],textmate bundle for rspec
195109,,[],[],ever wondered what http requests the ruby gem you are using to connect to a third party api is making use http spy to see what is going on behind the scenes
520140,,[],[],a haskell interpreter in javascript
621589,,[],[],integration testing for iphone applications with cucumber
276037,,[],[],user contributions for the asp net mvc framework
478105,,[],[],transparent persistence for mongodb
452111,,[],[],making html emails a little less painful writes css inline and corrects image urls
33173,,[],[],gui version of memcached for development
174060,,[],[],this plugin allows you to add jquery datagrids very easily to your rails applications
322930,,[],[],playdar a content resolver for music
3156,,[],[],a javascript bdd framework with nested a convenient assertion and an intuitive test browser
83007,,[],[],open source merb book
62889,,[],[],ruby toolkit for recurring billing and subscription management in software as a service saas web applications
341045,,[],[],create realtime webapps using django and orbited and twisted
540525,,[],[],implementation of neural language in particular collobert and weston  and a stochastic margin based version of mnih s lbl
242225,,[],[],image server and proxy that can resize images on demand based on common file prefixes such as and apply other rmagick effects supposed to be used between a squid and varnish and s
373356,,[],[],design patterns in ruby code samples based on the book with the same title
386900,,[],[],fzip is an actionscript  class library to modify and create standard zip archives
572324,,[],[],classic algorithm w for type inference
605206,,[],[],command line webpage screenshot and thubnail generator
1205388,,[],[],inspired by a simple control to load more rows into the tableview
65228,,[],[],this repository has relocated to http and and github com and appcelerator and
623824,,[],[],some pithy javascript for beautiful justified text
536838,,[],[],rit is a standalone web application that allows users to edit and schedule content content is served up to a consuming application as a web service
959597,,[],[],a simple python library and tool for pulling location information from unstructured text
223418,,[],[],a simple tool to go along with the first few milliseconds of an https connection blog post on moserware com
2184,,[],[],a collection of rspec matchers to be used with the ruby on rails project
55379,,[],[],activitystreams is a rails plug in providing a customizable framework for cataloging and publishing user activity and social objects
320914,,[],[],a rails engine to help integrate the signals wysihat rich text editor to your application
102155,,[],[],askit is an easy to use library for your ios applications askit provides appstore styled table views tags c
156775,,[],[],extension of the authlogic library to add openid support
542823,,[],[],android usb camera driver and bridge for gnu and linux
337109,,[],[],a jquery plugin that allows you to animate style properties based on the cursor s proximity to an object
235696,,[],[],the accompanying code for my three iphone tutorials at http and and www mattvague com and blog
214049,,[],[],authlogic oauth is an extension of the authlogic library to add oauth support oauth can be used to allow users to login with their twitter credentials
126864,,[],[],sample rails app for image cropping using paperclip and jcrop
3014,,[],[],adds query origin tracing to your logs
790561,,[],[],a delicious javascript web framework made in belgium
54620,,[],[],convert lua source code into an equivalent c source code written in terms of lua c api calls
276713,,[],[],a simple http server for node js that has sinatra like qualities ideal for generating web services via node
836596,,[],[],a command line twitter client with smart filtering and statistical classification
49435,,[],[],full featured restful authentication starter app from http and and railsforum com and viewtopic php id  combining role open id and security plugins
257894,,[],[],the glue framework for web development
447399,,[],[],neojr social is a self contained http rest and json interface to the graph database neoj neojr social supports simple dynamic node building relationships between nodes and also includes a few common social networking queries out of the box i e linkedin degrees of seperation and facebook friend suggestion with more to come think of neojr social is to neoj like solr is to lucene
376780,,[],[],full text search with any type of class or data store using redis
41994,,[],[],data binding plugin for jquery
720287,,[],[],content assist for textarea
63084,,[],[],top level repository with the entire vertebra distribution
29662,,[],[],moved to http and and github com and jpmobile and jpmobile
189430,,[],[],a better load simulator
46677,,[],[],a c read eval print loop abandoned
15448,,[],[],subscription management and processing etc
473519,,[],[],calendar api for iphone
832093,,[],[],the code behind the second incarnation of jailbreakme com
59626,,[],[],the erlang twist on web frameworks
823024,,[],[],a simple blog engine written with flask
30666,,[],[],this project is discontinued
544380,,[],[],sample files for use with face recognition in opencv
112635,,[],[],ffi based ruby library to access tokyo cabinet and tokyo tyrant this library is in maintenance mode see http and and jmettraux wordpress com and  and  and  and retiring rufus tokyo and for an explanation
630379,,[],[],twitter app for ipad that won best social app at ipaddevcamp nyc 
198453,,[],[],rack debug is middleware that provides a simple interface to ruby debug helps debug apps running in passenger
260263,,[],[],demonstrates how to use three s ttmodel system with ttthumbsviewcontroller and ttphotoviewcontroller
54422,,[],[],a new plugin for creating rails applications targeted for iphones a successor to
314472,,[],[],postgresql foreign keys for rails migration
394195,,[],[],devise facebook connect important not maintained anymore
305320,,[],[],my written with tornado and appengine
167887,,[],[],open source implementation of stackoverflow app not maintained
49839,,[],[],schema migration support for the sqlite library fmdb
13133,,[],[],rails plugin that allows through to go through other throughs
245879,,[],[],lean mean tokyo cabinet recipes with lua
53249,,[],[],fire and forget data collection and graphing service
231109,,[],[],lyndon wraps javascript in a loving macruby embrace a fun hack that is no longer maintained
366797,,[],[],a simple social news application demonstrating mongodb and rails
572950,,[],[],restful email for rails
